Prezzo,Nome,Descrizione,Link,Tipologia,Contratto,Piano,Piani edificio,Ascensore,Superficie,Locali,Camere da letto,Bagni,Arredato,Terrazzo,"Box, posti auto",Riscaldamento,Climatizzazione,Spese condominio,Cauzione
900.0,"Quadrilocale via Giuseppe Zamboni 4, Borgo Venezia, Verona","In Zona residenziale ben servita e molto tranquilla, comoda al centro città e all'Università,  proponiamo appartamento al quarto ed ultimo piano con ascensore di circa 110 mq commercial. L'immobile è composto da ingresso, cucina abitabile con balcone, soggiorno/pranzo con secondo balcone, due camere matrimoniali e bagno finestrato. L'immobile si presenta in ottime condizioni. Molto luminoso e tranquillo. Completamente arredato. Disponibile da subito. Contratti transitori per studenti o lavoratori. Spese condominiali € 220,00 mensili comprensive del riscaldamento centralizzato con termovalvole dell'appartamento a conguaglio. Utenze di luce, acqua e gas da intestare agli inquilini Climatizzatore Infissi in PVC con vetro camera doppio PRESENTAZIONE AGENZIA: Veronahome e una realtà consolidata, nel settore immobiliare di Verona, che grazie all'esperienza decennale da parte del suo fondatore Patuzzo Alessandro, desidera proporsi in modo alternativo ed innovativo sul mercato delle agenzie immobiliari. L'obiettivo e quello di offrire un servizio completo, affidabile ed attento alle singole esigenze, ponendo al centro il cliente e creando le reali opportunità che ogni venditore, acquirente, locatore o conduttore desiderano realizzare in un settore sempre piu in evoluzione come quello immobiliare. Da oggi, grazie a Veronahome, ogni vostra ricerca si trasforma in una semplice operazione con la garanzia di raggiungere velocemente l'obbiettivo richiesto.. . ed e per questo che ci piace affermare di essere lAgenzia immobiliare creata su misura per le vostre esigenze! .",https://www.immobiliare.it/annunci/103115880/,Appartamento | Intera proprietà | Classe immobile media,Affitto,"Piano terra, 4",4,Sì,115,4,2,1,Sì,No,,"Centralizzato, a radiatori, alimentato a gas","Autonomo, freddo/caldo",220.0,1800.0
1000.0,"Quadrilocale viale Alessandro Manzoni 14, Borgo Milano, Verona","Borgo Milano  in zona comoda a tutti i servizi affittiamo  appartamento AL PIANO ALTO PANORAMICO CON VISTA APERTA arredato e corredato. L'appartamento è composto da ingresso, ampio soggiorno con terrazza, cucina abitabile completa di frigo, forno e lavastoviglie, 2 camere da letto di cui una matrimoniale ed una singola, 2 bagni uno con vasca uno con doccia , ampio ripostiglio, terrazza vivibile con vista aperta, doppi vetri. Accessoriato con lavatrice , condizionatore , tv , stampante  , wifi,   Libero  primi di novembre 2024 Contratto annuale. Canone euro 1000 più spese forfettarie di euro 200 nelle quali sono comprese TUTTE le spese condominiali e dei consumi interni, luce, acqua, gas, riscaldamento, condizionamento. Per informazioni e referenze, scrivere via mail a verona@grandiagenzie.it",https://www.immobiliare.it/annunci/95592876/,Appartamento | Intera proprietà | Classe immobile signorile,"Affitto, transitorio",4,4,Sì,106,4,2,2,Sì,Sì,1 in box privato/box in garage,"Centralizzato, a radiatori, alimentato a gas",Autonomo,0,2600.0
900.0,"Bilocale via Amanti 12, Centro Storico, Verona","VIA AMANTI - In una zona molto tranquilla del centro storico, a due passi da Porta Leoni e Piazza delle Erbe, proponiamo bilocale di 50 mq. composto di soggiorno con angolo cottura, camera matrimoniale e un bagno finestrato. Internamente si presenta in buono stato con riscaldamento autonomo e aria condizionata. LIBERO DA DICEMBRE. CHIEDIAMO GENTILMENTE DI NON CHIAMARE AL NUMERO DI TELEFONO. MANDATE VIA MAIL LE VOSTRE REFERENZE E SARETE PRESTO RICHIAMATI, GRAZIE!",https://www.immobiliare.it/annunci/114549655/,Appartamento | Intera proprietà | Classe immobile signorile,Affitto,1,2,No,50,2,1,1,Sì,,,"Autonomo, a radiatori, alimentato a metano",Autonomo,50.0,-1
1650.0,"Appartamento via Prato Santo 1, Borgo Trento, Verona","DISPONIBILE DAL 1° GENNAIO '25, ad un passo dal ponte Garibaldi ed il centro pedonale di Verona, nel rinomato e servito quartiere di Borgo Trento, in palazzo del 1935 ""Razionalista"" che ha mantenuto i suoi caratteri distintivi, appartamento vuoto da mobili (I MOBILI ORA PRESENTI E FOTOGRAFATI APPARTENGONO ALL'ATTUALE CONDUTTORE) posto all'ultimo piano con ascensore, formato da: ampio ingresso, soggiorno con angolo cottura, salotto con straordinario affaccio e vista su Torricelle e campanili/torri del centro città, tre camere da letto matrimoniali, due bagni rifatti nel 2021, ripostiglio, balconi e terrazzo di 22mq ca.. E' inclusa la pertinenza di una cantina. Termocentrale con contabilizzatori di consumo, aria condizionata, luminosità e ventilazione straordinari. Contratto locazione 3 anni + 2 anni con opzione ""cedolare secca"". A.P.E. Classe G - I.P.E. 509,51 KWh / mq per anno. Ideale per famiglia referenziata di max 4 componenti. Non utilizzabile per attività di B&B o uso turistico. VISITE A PARTIRE DAL 22 SETTEMBRE. POTETE INVIARE LE VS RICHIESTE / REFERENZE TRAMITE EMAIL ALL'INDIRIZZO INFO@IMMOBILIAREFERRONI.COM.",https://www.immobiliare.it/annunci/89817781/,Appartamento | Intera proprietà | Classe immobile signorile,"Affitto, 3+2",5,5,Sì,151,5,3,2,No,Sì,,"Centralizzato, a radiatori, alimentato a metano","Autonomo, freddo/caldo",500.0,4950.0
800.0,"Quadrilocale Contrada Vendri 39, Quinto, Verona","Nella tranquilla e verdeggiante località Vendri a dieci minuti dal centro di Verona, all’interno dell’incantevole Villa Ca’ Vendri, proponiamo appartamento al primo piano con ingresso indipendente di circa 100 mq. Composto da soggiorno/pranzo con angolo cottura, un' ampia camera matrimoniale, de comode camere doppie,  bagno cieco con vasca, secondo bagno finestrato con doccia, ripostiglio e tre posti auto scoperti nella corte interna. Arredato e corredato. Molto tranquillo. L'immobile viene locato solo con contratti transitori ad un massimo di 4 studenti o lavoratori. Riscaldamento autonomo Climatizzatore nella camera matrimoniale. Contratto transitorio di 12 mesi per lavoratori Nelle spese condominiali pari a € 250,00 mensili sono comprese tutte le utenze  di luce, acqua, gas, tassa rifiuti, e rete Wi-Fi dell'appartamento a conguaglio. Travi a vista. Parquet. Cancello elettrico. PRESENTAZIONE AGENZIA: Veronahome è una realtà consolidata, nel settore immobiliare di Verona, che grazie all’esperienza decennale da parte del suo fondatore Patuzzo Alessandro, desidera proporsi in modo alternativo ed innovativo sul mercato delle agenzie immobiliari. L'obiettivo è quello di offrire un servizio completo, affidabile ed attento alle singole esigenze, ponendo al centro il cliente e creando le reali opportunità che ogni venditore, acquirente, locatore o conduttore desiderano realizzare in un settore sempre più in evoluzione come quello immobiliare. Da oggi, grazie a Veronahome, ogni vostra ricerca si trasforma in una semplice operazione con la garanzia di raggiungere velocemente l’obbiettivo richiesto ed è per questo che ci piace affermare di essere “ l’Agenzia immobiliare creata su misura per le vostre esigenze! ”.",https://www.immobiliare.it/annunci/97777142/,Appartamento | Intera proprietà | Classe immobile media,"Affitto, transitorio",1,3,No,100,4,3,2,Sì,No,2 in parcheggio/garage comune,"Autonomo, a radiatori, alimentato a gas","Autonomo, freddo",250.0,2100.0
1500.0,"Quadrilocale via Molinara 8, Borgo Roma, Verona","Borgo Roma in posizione comoda sia al polo univeristario di via delle Grazie ( policlinico di Borgo roma) che al centro in quanto ben collegato da una pista ciclabile e da mezzi pubblici si propone in locazione appartamento arredato in buon contesto condominiale sito al piano ultimo con ascensore composto da ingresso, salone con agnolo cottura ( cucina nuova con forno / microonde, lavastoviglie) che accede al terrazzo abitabile, 3 camere ad uso singolo di cui una con letto singolo, una matrimoniale ad uso singolo entrambe con accesso ad un balcone e infine una singola spaziosa con piazza e mezza, servizio finestrato con vasca e doccia, ripostiglio/lavanderia. Zona comune per parcheggiare le bici. Canone comprensivo di utenze, condominio, tari, internet salvo conguaglio. Contratto studentesco unico non a stanze. Possibilità di prenotare le stanzsingolarmente e anche di poter richiedere la borsa di studio. Pronto per fine agosto. Porta blindata, aria condizionata, vetrocamera. Per prenotare una visita rispondere al presente annuncio specificando nome e cognome delgi eventuali occupanti, che anno di univeristà frequentano e se vi sono genitori che possono fare da garante.",https://www.immobiliare.it/annunci/113875883/,Appartamento | Intera proprietà | Classe immobile signorile,"Affitto, studenti (6-36 mesi)","1, 4",4,Sì,116,4,3,1,Sì,Sì,,"Autonomo, a radiatori, alimentato a metano","Autonomo, freddo/caldo",0,3500.0
470.0,"Quadrilocale via De Ambrogi 1, Porto San Pancrazio, Verona","PORTO SAN PANCRAZIO: in zona strategica per l'università ed il centro proponiamo in locazione varie tipologie di stanze per universitari o lavoratori disponibili da subito. NO FAMIGLIE Il prezzo si intende già compreso di spese di consumo: acqua, luce, gas spazzatura. Per ulteriori informazioni scrivere una breve email di presentazione con il proprio recapito telefonico a vr1e7@tecnorete.it",https://www.immobiliare.it/annunci/114709933/,Appartamento | Intera proprietà | Classe immobile media,Affitto,3,6,Sì,110,4,3,2,Sì,No,,"Autonomo, a radiatori, alimentato a metano",Autonomo,100.0,-1
820.0,"Trilocale via Vittorio Locchi 34, Ponte Crencano, Verona","PER MEDICI SPECIALIZZANDI CON MATRICOLA UNIVERSITARIA L IMMOBILE NON PUÒ ESSERE LOCATO SENZA MATRICOLA UNIVERSITARIA. L IMMOBILE NON PUÒ ESSERE LOCATO SENZA MATRICOLA UNIVERSITARIA. Contattare esclusivamente rispondendo all'annuncio con le seguenti informazioni: - RIFERIMENTO AI820PC - nome, cognome, numero di cellulare - anno di specializzazione - indirizzo di specializzazione NON VERRANNO DATE INFORMAZIONI AL TELEFONO L IMMOBILE NON PUÒ ESSERE LOCATO SENZA MATRICOLA UNIVERSITARIA. A pochi minuti a piedi dall'ospedale di Borgo Trento, proponiamo in locazione appartamento trilocale interamente ristrutturato, arredato e climatizzato. L'immobile si compone di ingresso, soggiorno, cucina abitabile con balcone, camera matrimoniale e bagno. Contratto studenti in cedolare secca. Obbligo matricola universitaria.",https://www.immobiliare.it/annunci/114699231/,Appartamento | Intera proprietà | Classe immobile signorile,"Affitto, studenti (6-36 mesi)",Piano rialzato,3,No,60,3,1,1,Sì,No,,"Autonomo, a radiatori, alimentato a metano","Autonomo, freddo/caldo",40.0,2460.0
900.0,"Bilocale via Duomo 9, Centro Storico, Verona","DISPONIBILE SUBITO A SINGLE O COPPIA REFERENZIATA DI LAVORATORI, confortevole, particolare e tranquillo appartamento in centro a Verona zona Duomo, con soffitti alti 3,40mt., arredato e ristrutturato con buone finiture, posto al piano rialzato, in palazzina d’epoca del ‘600, a pochi passi dal Ponte Pietra e chiesa di Sant'Anastasia, nel centro pedonale della città. DESCRIZIONE APPARTAMENTO: ingresso, soggiorno, cucina abitabile, camera da letto matrimoniale (compreso materasso nuovo) con cabina armadio, bagno con doccia (compreso di lavatrice nuova). Ripostiglio e vano cantina. Riscaldamento autonomo. Infissi in legno con vetrocamera. A.P.E Classe E – I.P.E 169,08 KWh/mq per anno. Euro 50,00 mensili di spese condominiali. Non utilizzabile per attività uso turistico. Contratto di locazione 3 anni +2 anni con opzione “cedolare secca”.",https://www.immobiliare.it/annunci/111161881/,Appartamento | Intera proprietà | Classe immobile media,"Affitto, 3+2",Piano rialzato,3,No,80,2,1,1,Sì,No,,"Autonomo, a radiatori, alimentato a metano",,50.0,1800.0
1500.0,"Rustico via Trezzolano, Montorio, Verona","TREZZOLANO: INFORMAZIONI SOLO VIA EMAIL, RICCARDO.PASSIGATO@RINALDICASE.IT, SI RICHIEDE COPPIA DI INQUILINI REFERENZIATI. Abitazione recentemente riattata e rivista nell' impiantistica composta da soggiorno con camino, sala da pranzo, cucina abitabile, bagno al piano terra, al piano primo due camere matrimoniali, zona lavanderia doppi servizi, cabina armadio, al piano secondo ampia mansarda al grezzo, cantina collegata all' abitazione adatta a dispensa, all' esterno ampia zona a verde utilizzabile. Arredata come da foto e con elettrodomestici parzialmente nuovi.",https://www.immobiliare.it/annunci/111997911/,Rustico | Intera proprietà | Classe immobile signorile,"Affitto, 3+2","Interrato (-1), piano terra, da 1 a 2",2,No,198,5+,2,3,Sì,No,2 in box privato/box in garage,"Autonomo, a radiatori, alimentato a metano","Autonomo, freddo/caldo",0,4500.0
830.0,"Trilocale via Massimo d'Azeglio, San Zeno, Verona","PER INFORMAZIONI INVIARE ESCLUSIVAMENTE PER EMAIL AL SEGUENTE INDIRIZZO: sanzeno@artediabitare.it: - Nome/Cognome ; - Numero di telefono; - Attività lavorativa e tipo di contratto lavorativo ; - Persone che occuperanno l'immobile e per quanto tempo. San Bernardino, nel ricercato quartiere di San Zeno, trilocale completamente ristrutturato al 4° ed ultimo piano (senza ascensore) con splendida vista su quartiere. L'abitazione si compone di tre ampi locali: cucina abitabile, spazioso soggiorno attualmente adibito a camera da letto, camera matrimoniale spaziosa e bagno con finestra. Al piano superiore ampia soffitta di proprietà che offre ulteriori spazi di archiviazione. Possibilità di parcheggiare nella corte condominiale interna al fabbricato. Adatto ad 1 o 2 persone e libero dal 1 dicembre 2024.",https://www.immobiliare.it/annunci/114080765/,Appartamento | Intera proprietà | Classe immobile media,"Affitto, 3+2",4,4,No,82,3,1,1,Sì,No,1 in parcheggio/garage comune,"Autonomo, a radiatori, alimentato a gas","Autonomo, freddo",50.0,880.0
1500.0,"Quadrilocale corso Camillo Benso di Cavour, Centro Storico, Verona","DISPONIBILE DAL 1° NOVEMBRE A REFERENZIATI - In elegante palazzo d’epoca completamente ristrutturato a fine anni '90, a pochi passi dall'Arena e Castelvecchio e Porta Borsari, nel centro di Verona, in posizione tranquilla, luminoso ed accogliente appartamento posto al ultimo piano, distribuito su due livelli, arredato del solo blocco cucina (i mobili fotografati sono dell'attuale conduttore). L’abitazione è composta da: ampio soggiorno con cucina a vista, 2 camere da letto di cui una matrimoniale ed una doppia, studio, 2 bagni finestrati rispettivamente con doccia e vasca. Riscaldamento autonomo, aria condizionata, pavimenti in parquet, parti comuni interne/esterne perfette. Comoda cantina ed ampio posto auto coperto. A.P.E classe E – I.P.E 149,78 KWh/mq per anno. IDEALE PER UN FAMIGLIA DI MAX 4 PERSONE. Tassativamente non utilizzabile per attività turistica!",https://www.immobiliare.it/annunci/88666877/,Appartamento | Intera proprietà | Classe immobile signorile,"Affitto, 3+2",Da 3 a 4,4,Sì,120,4,3,2,Solo Cucina Arredata,No,1 in parcheggio/garage comune,"Autonomo, a radiatori, alimentato a metano","Autonomo, freddo",125.0,4500.0
1600.0,"Appartamento via dell'Artigliere 10, Veronetta, Verona","In elegante contesto di palazzo nobiliare, a pochi passi dal centro storico, proponiamo esclusivo appartamento al primo piano di 135 mq circa, con affaccio esterno e sul cortile interno. L’immobile caratterizzato da alti soffitti decorati, da pavimenti in seminato veneziano e parquet, si compone di un spazioso ingresso con accesso ad un balcone di 6 mq circa in parte verandato, un ampio soggiorno con zona cucina separata, uno stupendo salone con camino interamente decorato con stucchi del settecento, una camera matrimoniale con cabina armadio sul soppalco, uno studiolo/camera singola con armadio a muro, un bagno finestrato con doccia, un altro bagno con vasca, un piccolo ripostiglio, una piccola soffitta/ripostiglio, un garage per due auto di medie dimensioni al piano interrato. Libero da mobili, ad eccezione della cucina e della cabina armadio. Solo referenziati. - Contratto 3+2. - Spese condominiali: 100,00 euro mensili, salvo conguaglio; - Riscaldamento autonomo; - Porta blindata e videocitofono; - Lavatrice e lavastoviglie. PRESENTAZIONE AGENZIA: Veronahome è una realtà consolidata, nel settore immobiliare di Verona, che grazie all’esperienza decennale da parte del suo fondatore Patuzzo Alessandro, desidera proporsi in modo alternativo ed innovativo sul mercato delle agenzie immobiliari. L'obiettivo è quello di offrire un servizio completo, affidabile ed attento alle singole esigenze, ponendo al centro il cliente e creando le reali opportunità che ogni venditore, acquirente, locatore o conduttore desiderano realizzare in un settore sempre più in evoluzione come quello immobiliare. Da oggi, grazie a Veronahome, ogni vostra ricerca si trasforma in una semplice operazione con la garanzia di raggiungere velocemente l’obbiettivo richiesto.. . ed è per questo che ci piace affermare di essere “ l’Agenzia immobiliare creata su misura per le vostre esigenze!”",https://www.immobiliare.it/annunci/114079351/,Appartamento | Intera proprietà | Classe immobile signorile,"Affitto, 3+2",1,2,No,135,5,2,2,Solo Cucina Arredata,No,2 in box privato/box in garage,"Autonomo, a radiatori, alimentato a metano",,100.0,4800.0
1400.0,"Trilocale via Seminario,2, Veronetta, Verona","[ITA] Disponibile da: 02/11/2024 Mensilità minime prenotabili: 1 Per prenotare l'annuncio clicca sul bottone ""Prenota Qui"" [ENG] Available from: 02/11/2024 Minimum months rental: 1 To book the listing click on the button 'Book Here' COMPOSIZIONE IMMOBILE Appartamento di 80 mq recentemente ristrutturato, situato in un edificio antico nel cuore della città. La posizione centrale dell'appartamento permette di raggiungere comodamente i principali punti di interesse turistico e culturale. Punti di interesse nelle vicinanze: Balcone di Giulietta: 8 minuti a piedi Piazza delle Erbe: 8 minuti a piedi Piazza Bra: 12 minuti a piedi Teatro Romano: 10 minuti a piedi Giardino Giusti: 2 minuti a piedi Servizi nelle vicinanze: Parcheggio (Piazza Isolo): 2 minuti a piedi Supermercati e ristoranti: nel raggio di 150 metri Lo spazio: L'appartamento è composto da due ampie camere da letto, un salone spazioso e luminoso, una cucina moderna e un bagno completamente ristrutturato. L'atmosfera accogliente e il design curato nei dettagli rendono questo appartamento il luogo ideale per soggiornare in città.",https://www.immobiliare.it/annunci/113773125/,Appartamento | Intera proprietà | Immobile di lusso,"Affitto, transitorio",1,,,80,3,2,1,Sì,,,,,10.0,1400.0
1050.1000000000001,"Quadrilocale via Cantarane 67, Veronetta, Verona","Nei pressi di Porta Vescovo e comodo all’università, in contesto di sole tre unità abitative, proponiamo appartamento di 85 mq circa al terzo piano, senza ascensore. L’immobile si compone da ingresso, soggiorno/pranzo con cucinotto, camera doppia con balcone, due camere singole, un bagno finestrato. Arredato. Ideale per tre/quattro studenti universitari. Disponibile da subito. - Contratto transitorio per studenti universitari; - Spese condominiali, comprensive del consumo dell’acqua, 50,00 euro mensili, salvo conguaglio; - Riscaldamento autonomo e aria condizionata; - Lavatrice. PRESENTAZIONE AGENZIA: Veronahome e una realtà consolidata, nel settore immobiliare di Verona, che grazie all'esperienza decennale da parte del suo fondatore Patuzzo Alessandro, desidera proporsi in modo alternativo ed innovativo sul mercato delle agenzie immobiliari. L'obiettivo e quello di offrire un servizio completo, affidabile ed attento alle singole esigenze, ponendo al centro il cliente e creando le reali opportunità che ogni venditore, acquirente, locatore o conduttore desiderano realizzare in un settore sempre piu in evoluzione come quello immobiliare. Da oggi, grazie a Veronahome, ogni vostra ricerca si trasforma in una semplice operazione con la garanzia di raggiungere velocemente l'obbiettivo richiesto.. . ed e per questo che ci piace affermare di essere lAgenzia immobiliare creata su misura per le vostre esigenze!",https://www.immobiliare.it/annunci/113583299/,Appartamento | Intera proprietà | Classe immobile media,"Affitto, transitorio",2,3,No,85,4,3,1,Sì,No,,"Autonomo, a radiatori, alimentato a metano","Autonomo, freddo",50.0,2200.0
1500.0,"Trilocale vicolo Leoni,5, Centro Storico, Verona","[ITA] Disponibile da: 02/11/2024 Mensilità minime prenotabili: 1 Per prenotare l'annuncio clicca sul bottone ""Prenota Qui"" [ENG] Available from: 02/11/2024 Minimum months rental: 1 To book the listing click on the button 'Book Here' COMPOSIZIONE IMMOBILE Appartamento con 2 ampie camere da letto, con bagno privato interno. Le due camere sono silenziose; le camere sono ampie (25 mq). Una delle camere include anche un piccolo balcone. Entrambi i bagni sono nuovi e moderni. Contiene una cucina completamente attrezzata (frigo, lavastoviglie, bollitore, posate e utensili da cucina essenziali). C'è anche una zona salotto con divano. Secondo piano con ascensore. L'appartamento è situato nel centro storico di Verona e quindi le auto sono consentite solo fino a 2 minuti a piedi dall'appartamento (via Dogana / Stradone San Fermo). Il parcheggio può essere organizzato su richiesta e a pagamento (circa 10 minuti a piedi dall'appartamento).",https://www.immobiliare.it/annunci/113773127/,Appartamento | Intera proprietà | Immobile di lusso,"Affitto, transitorio",2,,,70,3,2,2,Sì,,,,,100.0,1500.0
1000.0,"Trilocale via Rocche, Centro Storico, Verona","Appartamento in zona adiacente al centro storico, in piccolo contesto di sole due unità, interno molto tranquillo, ottimo per TRE STUDENTI, composto da ingresso in soggiorno con zona cottura, bagno finestrato, piccolo soppalco ripostiglio, camera da letto doppia e camera singola, il tutto completamente arredato dotato di lavatrice e lavastoviglie, aria condizionata e riscaldamento autonomo. L'appartamento sarà disponibile da Settembre,  preferenze per un periodo medio lungo. Contattare solo via mail: stefania.bonente@gmail.com",https://www.immobiliare.it/annunci/113811399/,Appartamento | Intera proprietà | Classe immobile media,"Affitto, studenti (6-36 mesi)",2,2,No,70,3,2,1,Sì,No,,"Autonomo, a radiatori, alimentato a metano",Autonomo,30.0,3000.0
1050.0,"Bilocale Corticella Cadrega,3, Centro Storico, Verona","[ITA] Disponibile da: 15/12/2024 Mensilità minime prenotabili: 1 Mensilità massime prenotabili: 5 Per prenotare l'annuncio clicca sul bottone ""Prenota Qui"" [ENG] Available from: 15/12/2024 Minimum months rental: 1 Maximum months rental: 5 To book the listing click on the button 'Book Here' Appartamento bilocale arredato e corredato con tutto ciò che è necessario quando si è lontani da casa, Il canone di affitto comprende tutte le spese, esempio utenze, spese condominiali, tassa rifiuti e wi-fi. Si tratta di un appartamento in centro storico a Verona, vicino a Piazza Erbe e Portoni Borsari, quartiere silenzioso e tranquillo, in particolare modo la posizione nel pieno centro storico vi permetterà di raggiungere ogni parte della città comodamente a piedi o con autobus. È anche molto vicino all'ospedale Borgo Trento, circa 1 km (15 minuti a piedi), è l'ideale per fare assistenza a qualche caro in modo sereno e tranquillo oppure se lavorate in ospedale e avete un lavoro a turni. anche a 10 minuti a piedi dalla zona universitaria.",https://www.immobiliare.it/annunci/114568739/,Appartamento | Intera proprietà | Immobile di lusso,"Affitto, transitorio",3,,,40,2,1,1,Sì,,,,,0,700.0
1500.0,"Trilocale via Sant'Eufemia 9, Centro Storico, Verona","A ridosso di Porta Borsari, in caratteristica corte di origine medioevale, appartamento vuoto da mobili, con splendidi affreschi rinascimentali, posto al primo piano nobile con ascensore, formato da: soggiorno con angolo cottura, salottino, due camere da letto di cui una matrimoniale ed una singola, 2 bagni, ripostiglio ed ampio balcone/ballatoio, vano cantina e posto auto coperto. Termoautonomo, aria condizionata, ubicato in posizione tranquilla. Disponibilità immediata ed ideale per coppia referenziata. Spese condominiali 3.000,00 annui. Contratto locazione 3 anni + 2 anni con opzione ""cedolare secca"". A.P.E. Classe F - I.P.E. 321,80 Kwh/mq per anno. Non utilizzabile per attività di B&B o uso turistico.",https://www.immobiliare.it/annunci/67695535/,Appartamento | Intera proprietà | Classe immobile signorile,"Affitto, 3+2",1,3,Sì,110,3,2,2,No,No,1 in parcheggio/garage comune,"Autonomo, a radiatori, alimentato a metano","Autonomo, freddo",250.0,4500.0
1200.0,"Trilocale corso Camillo Benso di Cavour 44, Centro Storico, Verona","PRIMO CONTATTO TRAMITE E-MAIL Situato nel cuore di Verona, all'interno del rinomato Palazzo Canossa, proponiamo in affitto un elegante appartamento su due livelli collegati da una scala in legno. Questa esclusiva residenza unisce il fascino storico del palazzo con il comfort moderno, offrendo un ambiente unico nel suo genere. Caratteristiche dell'appartamento: - Livello inferiore: soggiorno con angolo cottura e bagno finestrato; - Livello superiore: spaziosa camera matrimoniale con bagno privato e camera singola; Palazzo Canossa, simbolo di prestigio e storia, è situato in una posizione strategica nel centro di Verona, a pochi passi dalle principali attrazioni della città. Canone mensile: 1.200 euro; Le utenze sono quantificate in 300 euro mensili, senza necessità di voltura da parte dell'inquilino; Maggiori informazioni in agenzia o al numero 3472453888 (Luca)",https://www.immobiliare.it/annunci/114679103/,Appartamento | Intera proprietà | Immobile di lusso,"Affitto, 3+2",4,4,Sì,91,3,2,2,Sì,No,,"Autonomo, a pavimento, alimentato a metano","Autonomo, freddo/caldo",0,3600.0
