Prezzo,Nome,Descrizione,Link,Tipologia,Contratto,Piano,Piani edificio,Ascensore,Superficie,Locali,Camere da letto,Bagni,Arredato,Terrazzo,"Box, posti auto",Riscaldamento,Climatizzazione,Spese condominio,Cauzione
2300.0,"Appartamento Stradone San Fermo 17, Centro Storico, Verona","Nel Centro Storico di Verona proponiamo un appartamento completamente ristrutturato in elegante edificio. Il palazzo storico si trova nelle vicinanze della piazza Brà, appena fuori dalla ZTL. L'abitazione è posta al terzo ed ultimo piano raggiungibile attraverso il vano scala con affreschi ed un comodo montapersone. Il restauro conservativo  ha mantenuto i materiali originali, come legno massello  nella zona notte, e marmi nella zona di corridoio della zona giorno. L'abitazione è dotata di un moderno impianto di riscaldamento autonomo ed aria condizionata in ogni stanza. All'interno troviamo un ampio e luminoso ingresso, un ampio salone, una sala pranzo/salotto, un cucina abitabile, uno studio/camera ospiti, un servizio finestrato con doccia, tre ampie camere matrimoniali un secondo servizio finestrato con vasca. Al piano interrato un 'ampia cantina. Possibilità di posto auto nei parcheggi pubblici nelle vicinanze.",https://www.immobiliare.it/annunci/107225653/,Appartamento | Intera proprietà | Classe immobile signorile,"Affitto, 3+2","Interrato (-1), 3",3,Sì,226,5+,4,2,No,No,,"Autonomo, a radiatori, alimentato a gas","Autonomo, freddo/caldo",75.0,6900.0
1200.0,"Bilocale vicolo Ghiaia 7, Cittadella - Porta Nuova, Verona","A pochi passi da Piazza Bra e dall'Arena di Verona, all'interno di un meraviglioso contesto storico del fine 700', proponiamo in locazione elegante ed esclusivo BILOCALE di prestigio completamente arredato. L'appartamento si trova al primo ed ultimo piano (SENZA ASCENSORE) di un piccolo edificio di sole 4 unità abitative e si compone di una zona giorno con cucina a vista, un piccolo corridoio, un bagno finestrato con doccia ed una camera da letto matrimoniale. Al piano interrato della proprietà vi è infine la possibilità di avere un comodo POSTO AUTO COPERTO al costo mensile aggiuntivo di 100€. L'immobile si presenta in ottime condizioni con finiture e materiali ricercati tra le quali pavimentazione in vero legno parquet, soffitto con travi in legno a vista e capriate, portoncino blindato, videocitofono, impianto di riscaldamento/raffrescamento tramite fan coil Daikin. Viene consegnato completo di tutti gli elettrodomestici necessari (compresa lavastoviglie e lavatrice) ed integralmente imbiancato di fresco. Contratto di locazione 4 + 4 senza cedolare secca, SI VALUTANO CONTRATTI ANCHE CON SOCIETA' per dirigenti/dipendenti. DISPONIBILE DAL 01 NOVEMBRE. NO AFFITTO TURISTICO. Per ulteriori informazioni o per programmare una visita sul posto contattare il numero seguente: 3894996918",https://www.immobiliare.it/annunci/114152205/,Appartamento | Intera proprietà | Classe immobile signorile,"Affitto, 4+4",1,2,No,50,2,1,1,Sì,No,,"Autonomo, ad aria, alimentato a metano","Autonomo, freddo/caldo",65.0,3600.0
4000.0,"Appartamento Interrato Redentore 5, Veronetta, Verona","Situato a pochi passi dal centro storico, subito aldilà del fiume Adige, affittasi ampio e luminoso appartamento di pregio con splendide terrazze abitabili e un comodo garage doppio. L'immobile è al piano secondo, servito da ascensore, di una palazzina in buono stato situata a poca distanza dal Teatro Romano e Ponte Pietra. L'appartamento, con una metratura complessiva di oltre 300 mq, gode di ampi spazi e comodità. Un ampio ingresso di accoglie e ci accompagna nel salone triplo, dove si differenziano zona salotto, zona pranzo, zona lettura e zona tv con camino, il tutto con accesso diretto alle due terrazze abitabili che ci consentono di fare colazione o cenare all'aperto. La zona notte, composta da quattro ampie camere, uno studio e tre bagni, gode di tranquillità ed è molto intima. All'interno dell'appartamento troviamo inoltre un comodo studio con accesso diretto dal salone, un cucinotto abitabile, ripostiglio e lavanderia. Pavimenti in parquet posato a spina di pesce ed altre finiture di pregio rendono questo immobile molto elegante e di grande carattere. Completano la proprietà un ampio box auto doppio, due soffitte, una cantina ed una straordinaria terrazza abitabile sul tetto dove poter ospitare amici per un aperitivo e rilassarsi sotto al sole. Soluzione unica nel suo genere, ideale per una famiglia numerosa o per chi necessita di ampi spazi e comodità.",https://www.immobiliare.it/annunci/114554427/,Appartamento | Intera proprietà | Classe immobile signorile,"Affitto, 3+2","Interrato (-1), 2, 4",4,Sì,322,5+,4,3,Parzialmente Arredato,Sì,2 in box privato/box in garage,"Centralizzato, a radiatori, alimentato a gas","Autonomo, freddo/caldo",140.0,12.0
1500.0,"Appartamento via Porta San Zeno, San Zeno, Verona","SAN ZENO: adiacente Basilica, affittasi in palazzetto bifamiliare, appartamento mq. 150- completamente arredato. Composizione: ingresso, ampia cucina abitabile con lavastoviglie, soggiorno, tre camere letto grandi, doppi servizi, cinque balconi. Riscaldamento autonomo, climatizzazione nel soggiorno e nelle camere, spese condominiali irrisorie, canone Euro 1.500,00. Si richiedono referenze. Contatti ed informazioni a mezzo email",https://www.immobiliare.it/annunci/111918045/,Appartamento | Intera proprietà | Classe immobile signorile,"Affitto, 3+2",2,3,No,150,5,3,2,Sì,Sì,,"Autonomo, a radiatori, alimentato a metano","Autonomo, freddo/caldo",0,-1
2000.0,"Appartamento via Prato Santo 26, Borgo Trento, Verona","Borgo Trento affittasi a referenziati appartamento di ampia metratura all'ultimo piano arredato , dotato di due postiauto cantina e soffitta, composto di ingresso corridoio salone salotto cucina abitabile tre camere da letto ripostiglio e  un ampio bagno disponibile dal 1 settembre",https://www.immobiliare.it/annunci/101817369/,Appartamento | Intera proprietà | Classe immobile signorile,Affitto,4,4,Sì,190,5,3,1,Sì,Sì,"1 in box privato/box in garage, 1 in parcheggio/garage comune",Autonomo,,0,-1
1250.0,"Quadrilocale ottimo stato, terzo piano, Centro Storico, Verona","libero da settembre 2024 per informazioni e appuntamenti inviare esclusivamente email al seguente indirizzo: veronacase@gmail.com le seguenti informazioni: - nome/cognome e numero di telefono - tipologia contratto di lavoro ed indicazione dell'attività lavorativa svolta di tutti gli occupanti - indicazione di quante persone abiteranno l'immobile/composizione nucleo famigliare. non saranno prese in considerazione le mail incomplete e verranno ricontattati esclusivamente i profili che rientrano nel target indicato dal locatore. centro storico, in stabile signorile e dotato di ascensore, appartamento al piano terzo composto da ampio ingresso, cucina abitabile, lavanderia, salotto, due camere entrambe con balcone e doppi servizi. riscaldamento autonomo, completamente arredato. - verona case è presente sul mercato dell’intermediazione immobiliare dal 1999 con una formula vincente ed è una realtà leader per innovazione, affidabilità e trasparenza. una metodologia di lavoro consolidata, frutto di anni di esperienza e di un costante e continuo aggiornamento in relazione alle evoluzioni del mercato e'' supportata da innumerevoli servizi ad alto valore aggiunto che consentono di far fronte ad ogni esigenza del cliente. pubblichiamo le offerte immobiliari su svariati portali e su stampa di vario genere (periodici del settore, volantini, cartellonistica etc.) e disponiamo inoltre di un’area intranet e di software informatici per verificare ed individuare potenziali clienti, avvalendoci anche di una ricca e fornita banca dati. valutazione dell’immobile: siamo in grado di effettuare una valutazione dell’immobile basata, oltre che su conoscenze edilizie, anche sulla conoscenza del territorio, della domanda e dell’offerta e dell’andamento del mercato. certificazioni energetiche: verona case si avvale di consulenti competitivi per produrre le attestazioni di prestazione energetica necessarie per poter vendere l’immobile gestendo completamente la procedura e facendo risparmiare il cliente. gestione permute: per il cliente che vuole comprare un immobile dopo aver venduto il proprio, verona case gestisce efficacemente la doppia intermediazione. visure e certificazioni: verona case esegue, in breve tempo, visure immobiliari sulle persone fisiche e giuridiche, acquisendo informazioni utili a tutelare le parti e favorendo così un esito positivo della trattativa. registrazione contratti di locazione: ogni contratto di locazione viene registrato presso gli enti preposti, direttamente dai nostri operatori immobiliari sollevando il cliente da tutte le incombenze burocratiche. assistenza in sede di rogito notarile: gli agenti verona case si fanno carico di presentare la documentazione necessaria al perfezionamento del rogito, presenziando personalmente e assistendo il cliente in questa fase della transizione. la nostra mission aziendale è: crescere come squadra che lavora duro, utile agli altri e aperta al cambiamento che, condividendo il metodo efficiente, sviluppa soluzi",https://www.immobiliare.it/annunci/106689547/,Appartamento | Intera proprietà | Classe immobile signorile,"Affitto, 3+2","3, 5",4,Sì,95,4,2,2,Sì,No,,"Autonomo, a radiatori, alimentato a gas",,50.0,2600.0
890.0,"Quadrilocale via della Valverde, Valverde, Verona","Presentiamo un'accogliente opportunità abitativa situata in una delle zone più comode e servite di Verona, Valverde, a pochi passi dal centro, dalla stazione e ben collegata con la tangenziale. L'appartamento, situato al secondo piano di tre in un piccolo palazzo d'epoca signorile, offre ambienti luminosi e funzionali. L'ingresso si apre su un ampio soggiorno, affiancato da una cucina abitabile e arredata. La zona notte include una spaziosa camera matrimoniale e uno studio versatile, ideale anche come seconda camera. Un bagno finestrato con doccia e un balcone con vista aperta completano questa confortevole residenza. Le spese condominiali contenute aggiungono ulteriore convenienza. Finiture: infissi in vetrocamera, portoncino blindato, pavimenti in ceramica, impianto elettrico a norma, aria condizionata. Contattaci oggi stesso per maggiori informazioni e per organizzare una visita. Non perdere l'occasione di vivere in una posizione strategica, con tutti i servizi a portata di mano. Rif. AA2447",https://www.immobiliare.it/annunci/114590977/,Appartamento | Intera proprietà | Classe immobile signorile,Affitto,2,3,,100,4,2,1,Solo Cucina Arredata,No,,,,40.0,-1
1750.0,"Appartamento via Ciro Menotti, Borgo Trento, Verona","VERONA - BORGO TRENTO In palazzo signorile , proponiamo ottimo appartamento ai piani alti, arredato di cucina, composto da: ingresso, cucina abitabile con terrazzino, doppio salone con ampio balcone, sala da pranzo, studio, n. 3 camere  matrimoniali di cui una con terrazzino privato e n. 2 servizi finestrati. Dotato di box auto DOPPIO, soffitta e cantina. Appartamento disponibile anche per locazione a società. Per informazioni e visite chiamare il num. 3271550606",https://www.immobiliare.it/annunci/113935549/,Appartamento | Intera proprietà | Classe immobile signorile,"Affitto, 4+4",4,6,Sì,220,5,3,2,Solo Cucina Arredata,Sì,2 in box privato/box in garage,"Centralizzato, a radiatori, alimentato a teleriscaldamento","Autonomo, freddo/caldo",0,-1
3000.0,"Appartamento corso Porta Nuova, Cittadella - Porta Nuova, Verona","A pochi passi dall'arena di Verona, in stabile d'epoca di rappresentanza, proponiamo signorile appartamento completamente arredato di circa 200 mq situato al secondo piano con ascensore. L'accesso alla proprietà avviene in duplice modo: direttamente dall'ascensore o dall'entrata di servizio dalle scale. La proprietà è suddivisa su due piani ed è composta al primo piano da una camera matrimoniale con bagno en suite, camera singola con bagno, ampio soggiorno e angolo cottura. Completa il piano un ampio terrazzo con affaccio sulla corte interna. Tramite l'ascensore interno è possibile raggiungere il soppalco abitabile composto da una camera, bagno/lavanderia ed una cabina armadio. L'appartamento dispone di un posto auto nel cortile interno.",https://www.immobiliare.it/annunci/107815635/,Appartamento | Intera proprietà | Classe immobile signorile,"Affitto, 3+2",2,3,Sì,200,5+,3,3,Sì,Sì,"1 in box privato/box in garage, 1 in parcheggio/garage comune","Centralizzato, a radiatori, alimentato a metano","Autonomo, freddo/caldo",600.0,-1
2900.3,"Appartamento via Dietro Listone, Centro Storico, Verona","Immerso nella storia e nel fascino di una delle zone più prestigiose e iconiche della Verona rinascimentale, questo esclusivo appartamento in locazione gode di una posizione eccezionale con vista panoramica sull'Arena. Situato in uno dei palazzi storici che definiscono la bellezza della rinomata Piazza Bra, questa proprietà è luminosa e spaziosa, ideale per accogliere una famiglia. Appena varcata la soglia d'ingresso, un ampio corridoio finestrato illumina l'appartamento di luce naturale, anticipando l'atmosfera accogliente che si respira all'interno. Il corridoio conduce al salone dal quale si accede ad un balcone panoramico, caratterizzato da una vista mozzafiato che cattura l'essenza della città. Le varie stanze dell'appartamento si sviluppano a partire dal corridoio centrale: una cucina abitabile, due bagni e tre ampie camere da letto, una delle quali si affaccia direttamente su Piazza Bra offrendo una vista impareggiabile. Il palazzo storico in cui si trova l'appartamento è dotato di ascensore, garantendo un facile e comodo accesso. Completa la proprietà anche una cantina situata al piano interrato.",https://www.immobiliare.it/annunci/111319669/,Appartamento | Intera proprietà | Classe immobile signorile,"Affitto, 4+4",2,4,Sì,170,5+,3,2,,Sì,,"Autonomo, a radiatori, alimentato a metano","Autonomo, freddo/caldo",170.0,-1
2000.0,"Appartamento corso Camillo Benso di Cavour, Centro Storico, Verona","Appartamento recentemente ristrutturato composto da soggiorno, angolo cottura, bagno, balcone che dà sul cortile interno. Dalla sala si accede con una scala al piano mansardato dove troviamo una camera matrimoniale, 2 singole e un bagno finestrato. L'appartamento è dotato di cantina. Possibilità di posto auto a parte. Informazioni e visite chiamare il 3457408545",https://www.immobiliare.it/annunci/114635951/,Appartamento | Intera proprietà,"Affitto, 3+2",3,,,130,5,3,2,Parzialmente Arredato,No,1 in parcheggio/garage comune,,,0,-1
2750.0,"Appartamento piazza San Fermo, Centro Storico, Verona","Immerso nel fascino del centro storico di Verona, questo esclusivo appartamento offre una vista dominante sulla splendida Chiesa di San Fermo e sul chiostro della suggestiva sede della Soprintendenza Belle Arti. L'appartamento si trova nelle immediate vicinanze di luoghi iconici come la Casa di Giulietta, Piazza Erbe ed è comodamente accessibile poiché svincolato dalla ZTL. Posizionato al terzo piano e con una superficie di 170 mq, l'appartamento dispone un ampio ingresso che conduce direttamente alla spaziosa zona living. Questa comprende un'accogliente sala da pranzo e un elegante ampio salotto, da cui è possibile godere di una vista panoramica dalle ampie finestre. Dal soggiorno è possibile accedere direttamente alla graziosa cucina e, proseguendo lungo il corridoio, all'area dedicata allo studio e alla zona notte. Quest'ultima include due eleganti camere da letto, una delle quali dotata di cabina armadio, e due luminosi bagni. Grazie alle numerose finestre e alle diverse esposizioni, tutte le aree dell'appartamento godono di una notevole illuminazione diurna. La proprietà è inoltre dotata di un ascensore e dispone di un piccolo ripostiglio. Questo immobile è ideale per chi desidera immergersi nel contesto romantico e ricco di storia che caratterizza Verona.",https://www.immobiliare.it/annunci/112632901/,Appartamento | Intera proprietà | Classe immobile signorile,"Affitto, 3+2",3,5,Sì,170,5+,2,2,Sì,No,,"Centralizzato, a radiatori, alimentato a metano","Autonomo, freddo/caldo",375.0,-1
2200.0,"Quadrilocale via Pallone 6, Centro Storico, Verona","NO AGENZIE. NO AFFITTO TURISTICO. ANCHE PER BREVI PERIODI. Appartamento del ‘600 di 200 mq,  completamente arredato (in parte con mobili dell’epoca). Solo a persone referenziate. L’appartamento è dotato di grande ingresso, enorme salone, piccola cucina. 3 camere da letto, 3 bagni, una piccola lavanderia. Cantine. Non è dotato di garage. Terrazza di 25 mq.",https://www.immobiliare.it/annunci/99699716/,Appartamento | Intera proprietà,Affitto,1,3,,200,4,3,3,Sì,Sì,,Autonomo,Freddo/caldo,150.0,2200.0
1050.0,"Appartamento ottimo stato, primo piano, Santa Croce, Verona","PER INFORMAZIONI: inviare esclusivamente email al seguente indirizzo: vr_bgo_venezia2@primacasa.it indicando le seguenti informazioni: - Nome/Cognome e numero di telefono - Indicazione di quante persone abiteranno l'immobile; - Verranno selezionati SOLO GRUPPI GIA' COMPOSTI (NO AFFITTO SINGOLA STANZA). SONO RICHIESTE REFERENZE DIMOSTRABILI. Nel cuore del quartiere SANTA CROCE, lontano da strade trafficate, ma comodo a tutti i principali servizi e mezzi pubblici, che permettono di raggiungere, sia la Facoltà di Scienza Motorie, sia le Facoltà in Veronetta. Proponiamo appartamento ristrutturato (ed arredato completamente) nel 2024, posto al piano primo (NO ASCENSORE) di 3 ampie camere da letto, tutte ad uso singolo con condizionatore a pompa di calore, zona soggiorno con cottura/pranzo comune, bagno finestrato, 2 balconi (di cui uno verandato). - ARREDATO E CORREDATO con lavatrice, lavastoviglie e TV; - CANONE COMPRENSIVO DI RETE WI-FI; - nel canone sono esclusi i consumi (forniture) dell’appartamento.",https://www.immobiliare.it/annunci/114633845/,Appartamento | Intera proprietà | Classe immobile signorile,"Affitto, transitorio",1,2,No,117,5,3,1,Sì,No,,"Autonomo, a radiatori, alimentato a gas","Autonomo, freddo/caldo",20.0,2100.0
0,"Trilocale via dei Lamberti 36, Borgo Roma, Verona","Privato concede in locazione con contratto agevolato per studenti universitari appartamento con tre camere indipendenti, complete di arredo composto da letto matrimoniale, armadio, cassettone e scrivania, servizi comuni cucina, bagno con lavatrice e al piano interrato garage e cantina",https://www.immobiliare.it/annunci/114404325/,Appartamento | Intera proprietà,Affitto,"Interrato (-2), 2",2,No,103,3,3,1,Sì,Sì,1 in box privato/box in garage,Centralizzato,Caldo,300.0,3150.0
670.0,"Trilocale primo piano, Borgo Roma, Verona","** ATTENZIONE : l'annuncio si rivolge principalmente a coppie/lavoratori/specializzandi/studenti. Per prenotare una visita e per ulteriori informazioni rispondere al presente annuncio SPECIFICANDO: 1) per quanto tempo servirebbe 2) quante persone abiteranno l'immobile 3) è richiesta una breve presentazione delle proprie referenze lavorative. Inserisci i dati del tuo attuale proprietario o di uno precedente, che può fornirci una tua referenza Verrete contattati da noi SOLO QUALORA ci fossero tutti i requisiti richiesti dal proprietario, per un eventuale appuntamento e verrà fissato un primo colloquio conoscitivo in agenzia. Per questo motivo è fondamentale scrivere una presentazione via mail più precisa e dettagliata possibile, in modo da essere facilmente identificabile tra tutte le numerose richieste. Verranno prese in considerazioni SOLO le candidature via mail. TRILOCALE ARREDATO LIBERO DAL 1 NOVEMBRE FINO AL 31 LUGLIO Solo Affitti propone luminoso trilocale di recente ristrutturazione in zona Borgo Roma al piano rialzato. L'appartamento  è composto da una cucina, da un soggiorno con balcone e una camera matrimoniale e un bagno finestrato con doccia.   E' dotato dei principali elettrodomestici quali forno e lavatrice. Il riscaldamento autonomo ed è presente il condizionatore. L'immobile viene consegnato ARREDATO e CORREDATO. Zona comoda ai servizi e nelle vicinanze del Policlinico di Borgo Roma. Le spese condominiali ammontano a circa €220,00 al mese, salvo conguaglio, e sono comprensive di tutte le utenze. Ideale per lavoratori/ studenti. Libero dal 1 NOVEMBRE 2024 FINO E NON OLTRE IL 31 LUGLIO 2025.",https://www.immobiliare.it/annunci/114107625/,Appartamento | Intera proprietà,"Affitto, transitorio",Piano rialzato,4,No,70,3,1,1,Sì,Sì,,Autonomo,"Autonomo, freddo/caldo",220.0,800.0
2200.0,"Appartamento via Prato Santo, Borgo Trento, Verona","Borgo trento - appartamento al 4° piano con ascensore con splendida vista sulla città e adige, composto da soggiorno, cucina, 3 camere, 2 bagni. ripostiglio, giardino privato, terrazzo e balconi, 1 posti auto con possibilità del secondo, e soffitta. Arredato. Solo referenziati. LIBERO DA 01/12/2024 Chiamare il 3457408545",https://www.immobiliare.it/annunci/114574613/,Appartamento | Intera proprietà,"Affitto, 4+4",4,,,190,5,3,2,Sì,Sì,"2 in box privato/box in garage, 2 in parcheggio/garage comune",,,0,4400.0
1400.0,"Appartamento via Ventiquattro Maggio, Borgo Trento, Verona",Borgo Trento libero al 10 novembre 2024 ingresso salone cucina arredata tre camere doppi servizi ampi balconi cantina soffitta e garage.,https://www.immobiliare.it/annunci/111847965/,Appartamento,Affitto,3,6,Sì,160,5+,3,2,,Sì,1 in box privato/box in garage,"Centralizzato, a radiatori","Autonomo, freddo",200.0,-1
2000.0,"Quadrilocale via Franco Faccio 8, Cittadella - Porta Nuova, Verona","Appartamento con tre camere letto matrimoniali, due bagni una cucina e un salotto situato in centro Verona",https://www.immobiliare.it/annunci/114059937/,Appartamento,Affitto,Seminterrato,3,,100,4,3,2,No,,,Autonomo,,0,4000.0
1190.0,"Appartamento 110 m², Veronetta, Verona","*** ATTENZIONE ANNUNCIO RIVOLTO A STUDENTI/ SPECIALIZZANDI *** Per prenotare una visita e per ulteriori informazioni rispondere al presente annuncio SPECIFICANDO: 1- quante persone abiteranno l'immobile 2- è richiesta una breve presentazione Inserisci i dati del tuo attuale proprietario o di uno precedente, che può fornirci una tua referenza Verrete contattati da noi SOLO QUALORA ci fossero tutti i requisiti richiesti dal proprietario, per un eventuale appuntamento. Per questo motivo è fondamentale scrivere una presentazione via mail più precisa e dettagliata possibile, in modo da essere facilmente identificabile tra tutte le numerose richieste. Verranno prese in considerazioni SOLO le candidature via messaggio/mail Affittasi ampio QUADRILOCALE PER STUDENTI e SPECIALIZZANDI disponibile dal 5 OTTOBRE L'appartamento dista circa a 10 minuti dal polo Zanotto. L'immobile è composto da ingresso,  cucina con balcone , tre camere da letto di cui una doppia, una singola e una matrimoniale e un bagno con doccia finestrato. Viene locato completamente arredato e corredato ed è dotato di lavatrice, il riscaldamento è autonomo. Dispone poi di una cantina Le spese condominiali ammontano a €30,00 euro al mese, salvo conguaglio Disponibile dal 5 OTTOBRE 2024 CONTRATTO TRANSITORIO PER STUDENTI 12 MESI CON POSSIBILITA' DI RINNOVO",https://www.immobiliare.it/annunci/112997195/,Appartamento | Intera proprietà,"Affitto, transitorio",1,,No,110,5,,,No,No,,,,30.0,-1
5500.0,"Attico via Santa Elisabetta 8, Santa Lucia - Golosine, Verona","VERONA - ATTICO CON PISCINA, affittasi per 1 ANNO. A 5 km da Piazza Bra, una soluzione unica, con più di 500 mq di terrazze e una meravigliosa piscina panoramica all'ultimo piano. L'abitazione di 250 mq si compone di soggiorno-pranzo, cucina, quattro camere ciascuna con il proprio bagno, bagno turco con cromoterapia e nella veranda una vasca idromassaggio e la palestra. Davanti alla zona giorno si trova un'ampia terrazza con veranda climatizzata, giardino perimetrale e una fontana in pietra sarda. Al piano soprastante vi e' un giardino pensile, parte a prato e parte pavimentato, con un gazebo servito da una cucina esterna con montavivande dalla sottostante cucina, oltre a un bagno di servizio. Al piano solarium si trova una piscina di 7 metri per 5 e una vasca idromassaggio, il tutto circondato da querce, olivi  e palme tropicali. Completano la proprietà due cantine e un garage di 60 mq. Termoautonomo, climatizzazione microclima, domotica, palestra Tecnogym, home cinema, musica ambientale in-out e ascensore con fermata riservata. Si richiede fidejussione bancaria pari a 1 anno. libero dal 15 dicembre 2024 - Codice R96",https://www.immobiliare.it/annunci/96417986/,Attico | Intera proprietà | Immobile di lusso,"Affitto, transitorio","Interrato (-1), da 4 a 5",5,Sì,422,5+,4,3+,Sì,Sì,2 in box privato/box in garage,"Autonomo, a pavimento, alimentato a gas","Autonomo, freddo/caldo",124.0,60.0
