Prezzo,Nome,Descrizione,Link,Tipologia,Contratto,Piano,Piani edificio,Ascensore,Superficie,Locali,Camere da letto,Bagni,Arredato,Terrazzo,"Box, posti auto",Riscaldamento,Climatizzazione,Spese condominio,Cauzione
1300.0,"Trilocale ottimo stato, quarto piano, Borgo Trento, Verona","Borgo Trento - Via Arsenale Si prega di contattare esclusivamente tramite il form in alto a destra ""contatta inserzionista"" indicando le seguenti informazioni: - nome, cognome, numero di cellulare; - numero di persone che occuperanno l'immobile; - occupazione e tipo contratto di lavoro. LE RICHIESTE SENZA TUTTE LE INFORMAZIONI NON VERRANNO GESTITE Proponiamo splendido appartamento completamente ristrutturato ed arredato di: ingresso, ampia sala, cucina abitabile con retrocucina e lavanderia, camera matrimoniale, camera doppia, 2 bagni, terrazzo vista Adige. Completa la proprietà un'ampia cantina. L'immobile è completo di tutti gli arredi, e dei seguenti elettrodomestici: Lavastoviglie, Forno, Microonde, Tv. Appartamento climatizzato, riscaldamento centralizzato con contacalorie e termovalvole. Massima serietà. Solo referenziati. Contratto transitorio 12-18 mesi massimo. No locazioni turistiche. Canone 1.300€ + 200€ di spese condominiali comprensive di riscaldamento. Si prega di non telefonare ma di fare riferimento alle istruzioni sopra indicate.",https://www.immobiliare.it/annunci/103391410/,Appartamento | Intera proprietà | Classe immobile signorile,"Affitto, transitorio",4,5,Sì,110,3,2,2,Sì,Sì,,,,0,-1
950.0,"Bilocale ottimo stato, primo piano, Valverde, Verona","In contesto storico con soli due unità, si propone appartamento ristrutturato di sala cucina abitabile camera cabina armadio bagno balcone. Completamente arredato e corredato. Termoautonomo e climatizzato. Solo con referenze reddituali dimostrabili. Si prega di non telefonare ma inviare un messaggio di presentazione. Sarete ricontattati",https://www.immobiliare.it/annunci/113679203/,Appartamento | Intera proprietà,"Affitto, concordato",1,2,No,90,2,1,1,Sì,,,"Autonomo, a radiatori, alimentato a metano","Autonomo, freddo/caldo",0,-1
1000.0,"Quadrilocale piazza San Zeno, San Zeno, Verona","San Zeno affittasi quadrilocale recentemente ristrutturato arredato. L'appartamento è composto di ingresso, soggiorno,cucna,  due camere, un bagno. e servizio lavanderia cantina e  L'appartamento è stato ristrutturato integralmente e presenta ottime  finiture , e  riscaldamento autonomo.  Per i L'appartamento sarà disponibile da Maggio 2024 per informazioni telefonare al 335.5303460 e 349.8136778.",https://www.immobiliare.it/annunci/99820864/,Appartamento | Intera proprietà | Classe immobile signorile,"Affitto, 3+2",2,2,No,110,4,2,2,Sì,No,,"Autonomo, a radiatori, alimentato a gas","Autonomo, freddo/caldo",30.0,3000.0
1650.0,"Quadrilocale ottimo stato, primo piano, Veronetta, Verona","Elegante e raffinata soluzione abitativa composta da salone di rappresentanza con camino, cucina, due camere da letto, due bagni, balcone e soppalco. Contesto signorile, finemente arredato, riscaldamento e condizionamento autonomi.",https://www.immobiliare.it/annunci/113197917/,Appartamento | Intera proprietà | Classe immobile signorile,Affitto,1,2,No,120,4,2,2,Sì,,2 in box privato/box in garage,"Autonomo, a radiatori",Autonomo,80.0,-1
1600.0,"Trilocale piazza delle Erbe, Centro Storico, Verona","A pochi passi da Piazza delle Erbe, all'interno di un palazzo signorile ubicato al terzo piano,(senza ascensore) proponiamo in locazione magnifico trilocale di 90 mq finemente ristrutturato ed elegantemente arredato. L'immobile si compone di: ingresso, ampio soggiorno con cucina a vista, 2 balconi con splendido affaccio sulla piazza, disimpegno, camera matrimoniale con bagno e cabina armadio, camera doppia, secondo bagno finestrato, lavanderia e altri 2 balconcini. Termoautonomo e completamente climatizzato.  Serramenti in legno con vetrocamera, parquet di rovere, portoncino blindato. Immobile completamente arredato, completo di tutti gli elettrodomestici. Canone richiesto € 1.600 + Spese condominiali pari a circa €30 mensili. Contratto di locazione transitorio 12/18 mesi - Si valuta eventuale contratto con società, ad uso foresteria. NO LOCAZIONI TURISTICHE. Massima serietà, solo referenziati. Si prega di contattare tramite il form in alto a destra ""contatta inserzionista"" indicando le seguenti informazioni: - nome, cognome, numero di cellulare; - numero di persone che occuperanno l'immobile; - occupazione e tipo di contratto lavorativo.",https://www.immobiliare.it/annunci/111140477/,Appartamento | Intera proprietà | Classe immobile signorile,"Affitto, transitorio",3,4,No,90,3,2,2,Sì,,,"Autonomo, a radiatori",Autonomo,0,-1
1200.0,"Quadrilocale ottimo stato, secondo piano, Pindemonte, Verona","VERONA, quartiere Pindemonte, nelle immediate vicinanze dell'Ospedale di Borgo Trento, in  recente  piccolo condominio signorile,  con ascensore , al secondo di 4 piani, senza barriere architettoniche,  AFFITTASI bellissimo appartamento completamente arredato composto di ingresso, cucinotto, sala da pranzo/soggiorno con splendido  terrazzo di circa  23 mq.  affacciato  sul verde e vista  Torricelle, camera matrimoniale e  seconda camera con letto matrimoniale, due bagni finestrati,  di cui uno con  vasca  idromassaggio jacuzzi e secondo con doccia sauna/bagno turco Teuco. Ceramica ovunque, impianto allarme, riscaldamento e condizionamento autonomo, diviso zona giorno e zona notte,  tenda elettrica sul terrazzo a copertura e chiusura in base condizioni climatiche , tapparelle elettriche,  GARAGE 21 mq. Vicino a tutti i servizi,  scuole, negozi, impianti sportivi e cinema a due passi, come pure 100 mt a piedi da ospedale di Borgo Trento se specializzandi o medici. Spese condominiali circa 550 euro all'anno, circa 45,00  euro al mese. SOLO persone referenziate, libero dal 15 di novembre 2024. Le visite inizieranno dal 25 settembre 2024 . NO SUBAFFITTO, NO LOCAZIONI TURISTICHE.  Inviare mail con presentazione a mariella.ruberti@rubertimmobiliare.it",https://www.immobiliare.it/annunci/74752672/,Appartamento | Intera proprietà | Classe immobile signorile,"Affitto, 3+2","Interrato (-1), 2",4,Sì,97,4,2,2,Sì,Sì,1 in box privato/box in garage,"Autonomo, a pavimento","Autonomo, freddo/caldo",45.0,-1
2900.0,"Villa unifamiliare Stradella Giazzole, Torricelle, Verona","In posizione panoramica e luminosa delle Torricelle, rarissima opportunità di splendido casale di ampia metratura, completamente ristrutturato a nuovo in affitto, immerso nel verde di un bel giardino privato, con finiture di pregio molto curate ed impiantistica di ultima generazione, mai abitato, si compone di ingresso, soggiorno, cucina arredata a nuovo, lavanderia, ripostiglio, tre camere da letto, TERRAZZO panoramico, tre bagni, giardino privato panoramico, posti auto. La residenza viene consegnata con l'arredamento della cucina e dei bagni. Classe energetica A4 Bassissime spese di consumo, riscaldamento e raffrescamento in pompa di calore con batteria di accumulo. Solo a referenziati. Informazioni riservate presso i nostri uffici previo appuntamento.",https://www.immobiliare.it/annunci/113588523/,Villa unifamiliare | Intera proprietà | Classe immobile signorile,Affitto,Piano terra,3,,170,5,3,3,Parzialmente Arredato,Sì,2 in parcheggio/garage comune,Autonomo,Autonomo,0,-1
3400.0,"Villa unifamiliare Stradella Giazzole, Avesa, Verona","In posizione panoramica e luminosa delle Torricelle, rarissima opportunità di splendido casale di ampia metratura, completamente ristrutturato a nuovo e mai abitato, in affitto, immerso nel verde di un bel giardino privato, con finiture di pregio molto curate ed impiantistica di ultima generazione, mai abitato, disposto su tre livelli, si compone di ingresso, soggiorno, cucina arredata a nuovo e zona pranzo, lavanderia, ripostiglio,quattro camere da letto, quattro bagni, giardino privato panoramico, posti auto. La residenza viene consegnata con l'arredamento della cucina e dei bagni. Classe energetica A4 Bassissime spese di consumo, riscaldamento e raffrescamento in pompa di calore con batteria di accumulo. Solo a referenziati. Informazioni riservate presso i nostri uffici previo appuntamento.",https://www.immobiliare.it/annunci/113588525/,Villa unifamiliare | Intera proprietà | Classe immobile signorile,Affitto,Piano terra,2,,210,5+,4,3+,Parzialmente Arredato,,2 in parcheggio/garage comune,Autonomo,Autonomo,0,-1
1200.0,"Quadrilocale salita Monte Grappa 1, Borgo Trento, Verona","Borgo trento vicinanze Ospedale maggiore affittasia mpio quadrilocale  in una  casa quadrifamiliare. L'appartamento posto al primo piano è composto da un ampio soggiorno con terrazzo   cucina abitabile con  patio esterno composto  due camere, servizio finestrato  e garage l'appartamento è stato oggetto di una ristrutturazzine  completa. L'appartamento viene locato libero arredato di cucina. Per informazioni  telefonare al 3355303460",https://www.immobiliare.it/annunci/112289053/,Appartamento | Intera proprietà | Classe immobile signorile,"Affitto, 4+4",1,3,No,100,4,2,1,Solo Cucina Arredata,Sì,1 in box privato/box in garage,"Autonomo, a radiatori, alimentato a gas","Autonomo, freddo/caldo",50.0,3600.0
950.0,"Trilocale via Paradiso 19, Veronetta, Verona","Pregevole appartamento in torretta di palazzo storico, tranquillo e panoramico con vista 360 gradi sui tetti di Verona.",https://www.immobiliare.it/annunci/114665707/,Appartamento | Intera proprietà,Affitto,3,3,No,65,3,2,1,Parzialmente Arredato,,,Autonomo,Freddo,30.0,1900.0
700.0,"Monolocale ottimo stato, piano rialzato, Santa Lucia - Golosine, Verona","In zona ben servita comoda a tutti i servizi principali, proponiamo un monolocale al piano rialzato compreso di utenze. L'immobile è composto una stanza con bagno, il tutto arredato. Per informazioni contattare via mail.",https://www.immobiliare.it/annunci/103665446/,Appartamento | Intera proprietà | Classe immobile media,"Affitto, transitorio",Piano rialzato,6,No,30,1,1,1,Sì,No,,"Centralizzato, a radiatori, alimentato a gas","Autonomo, freddo/caldo",0,1400.0
2500.0,"Appartamento ottimo stato, primo piano, Centro Storico, Verona","CENTRO STORICO:   a due passi da piazza erbe affittiamo ottimo appartamento primo piano NO ascensore  ristrutturato e arredato completamente,  Cucina con balcone  e  lavanderia, salotto, 2 camere ampie matrimoniali e una singola, Un bagno ampio con doccia . Completo di  box auto  di 28 mq, larghezza ingresso 2,5 mt e altezza 2 mt. lungo 8 mt. Contratto transitorio . Si prega di inviare un quadro di presentazione via mail .",https://www.immobiliare.it/annunci/114592735/,Appartamento | Intera proprietà | Classe immobile signorile,Affitto,1,2,No,135,5,3,1,Sì,No,1 in box privato/box in garage,Autonomo,Freddo,25.0,-1
890.0,"Quadrilocale ottimo stato, primo piano, Quinto, Verona","QUINTO: NON CHIAMARE. Per informazioni inviare esclusivamente un'email all' indirizzo vr_quinto@primacasa.it indicando: nome e cognome e numero di telefono, tipologia di contratto di lavoro ed indicazione dell'attività lavorativa svolta, indicazione di quante persone abiterebbero l'immobile, presenza o meno di animali; SAREMO NOI A RICHIAMARE solo nel caso in cui la richiesta venga valutata positivamente dalla proprietà. Non saranno prese in considerazione le mail incomplete. QUINTO DI VALPANTENA: In splendida dimora storica completamente e sapientemente restaurata immersa all'interno di un parco con piante secolari,  proponiamo appartamento posto al piano primo, composto da soggiorno/pranzo, cucinotto, 2 camere e 2  bagni. Completano l'immobile un garage  ed un posto auto esterno.",https://www.immobiliare.it/annunci/114278527/,Appartamento | Intera proprietà | Immobile di lusso,"Affitto, 3+2","Interrato (-1), piano terra, 1",3,No,106,4,2,2,Solo Cucina Arredata,No,"1 in box privato/box in garage, 1 in parcheggio/garage comune",Autonomo,,120.0,-1
1200.1,"Bilocale ottimo stato, primo piano, Cittadella - Porta Nuova, Verona","Siete alla ricerca di un appartamento bilocale in affitto? Questa è l'opportunità che stavate cercando! Situato nel comune di Verona, in contesto prestigioso, questo luminoso appartamento si trova in prossimità di Piazza Cittadella e dell'Arena. Con una superficie di 41 mq, questa proprietà offre comfort e praticità per la vita quotidiana. L'appartamento si trova al primo e ultimo piano senza ascensore ed è composto da ingresso, cucina con ampio soggiorno, camera matrimoniale e bagno finestrato. È completamente arredato e dotato di aria condizionata per garantire il massimo comfort tutto l'anno. Inoltre, vi è la possibilità di usufruire di un posto auto coperto (con costo addizionale). Le spese condominiali ammontano a soli 65 euro mensili. La locazione è libera da fine ottobre 2024. Non mancate quest'occasione unica!",https://www.immobiliare.it/annunci/114026727/,Appartamento | Intera proprietà | Classe immobile signorile,"Affitto, 4+4",1,2,No,41,2,1,1,Sì,No,,Autonomo,"Autonomo, freddo/caldo",65.0,3900.0
250.0,"Trilocale via dei Grolli 11, Borgo Roma, Verona","A pochi passi dal Policlinico disponibile, in stanza matrimoniale arredata, posto letto singolo. Solo per studentesse femmine, la camera sarà in condivisione con altra studentessa. Aria condizionata.",https://www.immobiliare.it/annunci/114074051/,Appartamento | Intera proprietà | Classe immobile economica,"Affitto, studenti (6-36 mesi)",Piano rialzato,4,,,3,1,1,Sì,,,Centralizzato,"Autonomo, freddo/caldo",0,-1
1000.0,"Quadrilocale buono stato, piano terra, Veronetta, Verona","V. ze Ponte Nuovo a due passi dal centro storico, affittasi appartamento al piano terra di una palazzina di sole 3 unità. L'immobile, completo di arredamenti dal sapore classico è composto da entrata, cucina appartata, soggiorno indipendente, camera matrimoniale,  bagno con doccia e locale lavanderia/ripostiglio. Richiesta canone euro 1.000,00 mensili .No spese condominiali. Cl energ E Ipe 127,24. Si prega di inviare una mail di presentazione all' indirizzo - info@fm-immobiliarevr.it. Solo referenziati",https://www.immobiliare.it/annunci/111716515/,Appartamento | Intera proprietà | Classe immobile signorile,"Affitto, 3+2",Piano terra,2,No,80,4,1,1,Sì,No,,"Autonomo, alimentato a metano",,0,-1
600.0,"Monolocale ottimo stato, piano terra, Veronetta, Verona","non telefonare inviare esclusivamente email al seguente indirizzo: veronacase@gmail.com indicare nella mail: - quante persone abiteranno l'immobile e composizione nucleo famigliare - nome e cognome di tutte le persone che occuperanno l'immobile - tipologia contratto di lavoro di tutti ed indicazione dell'attività lavorativa svolta - numero di telefono per ricontattare i profili selezionati. non saranno prese in considerazione le mail incomplete e verranno ricontattati esclusivamente i profili che rientrano nel target indicato dal locatore. monolocale recentemente ristrutturato, sito al piano terra, composto da un'unica zona giorno/notte, angolo cottura attrezzato e bagno finestrato. - verona case è presente sul mercato dell’intermediazione immobiliare dal 1999 con una formula vincente ed è una realtà leader per innovazione, affidabilità e trasparenza. una metodologia di lavoro consolidata, frutto di anni di esperienza e di un costante e continuo aggiornamento in relazione alle evoluzioni del mercato e' supportata da innumerevoli servizi ad alto valore aggiunto che consentono di far fronte ad ogni esigenza del cliente. pubblichiamo le offerte immobiliari su svariati portali e su stampa di vario genere (periodici del settore, volantini, cartellonistica etc.) e disponiamo inoltre di un’area intranet e di software informatici per verificare ed individuare potenziali clienti, avvalendoci anche di una ricca e fornita banca dati. valutazione dell’immobile: siamo in grado di effettuare una valutazione dell’immobile basata, oltre che su conoscenze edilizie, anche sulla conoscenza del territorio, della domanda e dell’offerta e dell’andamento del mercato. certificazioni energetiche: verona case si avvale di consulenti competitivi per produrre le attestazioni di prestazione energetica necessarie per poter vendere l’immobile gestendo completamente la procedura e facendo risparmiare il cliente. gestione permute:  per il cliente che vuole comprare un immobile dopo aver venduto il proprio, verona case gestisce efficacemente la doppia intermediazione. visure e certificazioni: verona case esegue, in breve tempo, visure immobiliari sulle persone fisiche e giuridiche, acquisendo informazioni utili a tutelare le parti e favorendo così un esito positivo della trattativa. registrazione contratti di locazione: ogni contratto di locazione viene registrato presso gli enti preposti, direttamente dai nostri operatori immobiliari sollevando il cliente da tutte le incombenze burocratiche. assistenza in sede di rogito notarile: gli agenti verona case si fanno carico di presentare la documentazione necessaria al perfezionamento del rogito, presenziando personalmente e assistendo il cliente in questa fase della transizione. la nostra mission aziendale è: crescere come squadra che lavora duro, utile agli altri e aperta al cambiamento che, condividendo il metodo efficiente, sviluppa soluzioni efficaci orientate al cliente per essere riconosciuta come punto di riferimento eccellente",https://www.immobiliare.it/annunci/114225757/,Appartamento | Intera proprietà | Classe immobile signorile,"Affitto, 4+4",Piano terra,2,No,25,1,,1,Sì,No,,"Autonomo, ad aria",,0,1200.0
1500.0,"Quadrilocale ottimo stato, primo piano, Borgo Trento, Verona","BORGO TRENTO: nel cuore verde del quartiere affittiamo appartamento arredato, cucina maistri a vista sulla sala/soggiorno, ingresso con ampio ripostiglio, bagno con vasca e doccia, 2 camere da letto e una veranda attrezzata come lavanderia. Pronto dal primo di ottobre. Disponibilità a sublocazione turistica.  Inviare un quadro di presentazione via mail.",https://www.immobiliare.it/annunci/114593511/,Appartamento | Intera proprietà | Classe immobile media,Affitto,1,4,No,95,4,2,1,Sì,No,,Centralizzato,Freddo,108.0,-1
1800.0,"Trilocale ottimo stato, primo piano, Valverde, Verona","Proponiamo in affitto transitorio ampio trilocale recentemente ristrutturato e completo di arredo. Appartamento con un'ottima esposizione e molto luminoso composto da cucina abitabile con zona living, due camere da letto matrimoniali e due bagni. Balconi presenti nella zona pranzo e in una camera matrimoniale. Contratto transitorio con scadenza in Aprile 2024. Richiesta canone mensile € 1900,00 + € 100,00 utenze. Disponibilità immediata. Per informazioni +39 393 88 69 292",https://www.immobiliare.it/annunci/106428081/,Appartamento | Intera proprietà,"Affitto, transitorio",1,3,,130,3,2,2,Sì,No,,,,0,-1
1100.0,"Monolocale via Legnago, Borgo Roma, Verona","Furnished two-room apartment for rent in Verona in the Borgo Roma area, Via Legnago, with independent entrance, balcony, washing machine in the house, a large bedroom, kitchen, separate small bedroom, large bathroom and enclosed internal parking space. The apartment is located in the context of a single house, free on three sides. One double bed in the living room / kitchen and 2 single beds in the bed room. \nTraduci la descrizione dell'annuncio in italiano",https://www.immobiliare.it/annunci/114733129/,Appartamento,Affitto,,,,35,1,1,,Sì,,,Centralizzato,Autonomo,0,-1
1100.0,"Monolocale via Antonio Cantore, Centro Storico, Verona","The apartment consists of a large living area with the kitchen with a 3 seaterwhite table in a modern style and a big white sofa.  The bathroom has a  shower. The apartment is located on the second floor of a building with elevator. The apartment is equipped with air conditioning, heating, refrigerator, microwave oven, washing machine and everything you need for your maximum comfort.\nTraduci la descrizione dell'annuncio in italiano",https://www.immobiliare.it/annunci/114720545/,Appartamento,Affitto,,,,55,1,1,,Sì,,,Autonomo,Autonomo,0,-1
1300.0,"Monolocale Interrato Acqua Morta, Veronetta, Verona","The 50 m2 apartment, in Verona, has 1 bedroom and a capacity for 4 people. The kitchen is equipped with a refrigerator, microwave, freezer, washing machine, dishwasher, dishes/cutlery, kitchen utensils, and coffee maker. More features are included: iron, hairdryer, individual gas boiler, air conditioning in all rooms, 1 TV. RENTAL CONDITION: - Deposit is 1 monthly rent to be paid at the check-in day - Utilities are not included - One-time agency fee to be paid at the check-in day that includes property maintenance and assistance. Nearby Amenities: -300 m from the supermarket ""INS"", -300 m ""Adige"", 500 m from the supermarket ""Pam"", Nearby Transport: -2 km from the train station ""Verona Porta Nuova Station"", -2 km from the station of the ""Verona Porta Nuova Station"" buses, -12 km from the ""Valerio Catullo Airport"" airport, Nearby too: -16 km from the ""Golf Club Verona"" golf course, -28 km from the ""Caneva Park"" water park, -30 km from the ""Gardaland"" playground, -32 km ""Garda Lake"". Please be aware that HousingAnywhere is an online booking platform. Therefore exchanging contact details and offering viewings is not possible. If you would like to reserve this accommodation, send me a booking request or a message and please mention your age and occupation. I look forward to meeting you! L'appartamento a Verona ha 1 camera(e) da letto e capacitÃ  per 4 persone. Alloggio dal 55 m2. Si trova a 0 m della cittÃ  ""Verona"", 300 m dal supermercato ""INS"", 300 m ""Adige"", 500 m dal supermercato ""Pam"", 2 km dalla stazione dei treni ""Stazione Verona Porta Nuova"", 2 km dalla stazione degli autobus ""Stazione Verona Porta Nuova"", 12 km dall'aeroporto ""Aeroporto Valerio Catullo"", 16 km dal campo di Golf ""Golf Club Verona"", 28 km dal parco acquatico ""Caneva Park"", 30 km dal parco giochi ""Gardaland"", 32 km ""Lago di Garda"". Ha ferro da stiro, asciugacapelli, caldaia individuale a gas, aria condizionata in tutte la stanze, 1 Televisore. La cucina indipendente, a induzione, Ã¨ attrezzata con frigorifero, congelatore, lavatrice, lavastoviglie, stoviglie/posate, utensili da cucina.\nTraduci la descrizione dell'annuncio in italiano",https://www.immobiliare.it/annunci/108420997/,Appartamento,Affitto,,,,60,1,1,,Sì,,,Autonomo,Autonomo,0,-1
1200.0,"Monolocale via Lovanio, Zona Fiera, Verona","We rent this new and fully equipped two-room-apartment, less than 1km to Verona fiera, close to Bar Bauli, shopping mall Adigeo and all big bus lines. It has one french bed (1,40x2m) and one single bed (90cmx2m), air condition, heating, private entrance, public parking in front. \nTraduci la descrizione dell'annuncio in italiano",https://www.immobiliare.it/annunci/114733145/,Appartamento,Affitto,,,,55,1,1,,Sì,,,Centralizzato,Autonomo,0,-1
5200.0,"Trilocale via San Carlo, Veronetta, Verona","Lappartamento si apre sul soggiorno con confortevole divano, TV e un angolo lettura con libreria a muro e una vetrata che si affaccia sulla distintiva grotta che Ã¨ ricavata nella roccia fuori dallappartamento e in cui Ã¨ possibile riposare su una delle poltroncine da esterno presenti nellinsenatura. Accanto al soggiorno si trova una cucina moderna e completamente attrezzata, dotata di forno, lavastoviglie, microonde e separata parzialmente da unelegante zona pranzo. Dalla cucina Ã¨ possibile accedere direttamente al giardino esterno attrezzato con tavolo e sedie per godersi una rilassante cena allaperto circondati dal giardino e con vista sullo splendido Santuario della Madonna di Lourdes. Completa la zona giorno un bagno completo con ampia doccia e una zona lavanderia. Dal soggiorno un breve corridoio porta alla zona notte, che si compone di una prima camera da letto con due letti singoli e un ampio armadio a parete e di una seconda camera con letto matrimoniale un bagno privato completo di vasca da bagno. A completare lalloggio vi Ã¨ un posto auto privato allinterno del garage del condominio, facilmente raggiungibile con lascensore che si trova al di fuori dellappartamento. Lalloggio Ã¨ dotato di WiFi e impianto di condizionamento e riscaldamento autonomo.\nTraduci la descrizione dell'annuncio in italiano",https://www.immobiliare.it/annunci/114338661/,Appartamento,Affitto,,,,100,3,2,,Sì,,,Autonomo,Autonomo,0,-1
1100.0,"Monolocale via Lovanio, Zona Fiera, Verona","We rent this new and fully equipped two-room-apartment, less than 1km to Verona fiera, close to Bar Bauli, shopping mall Adigeo and all big bus lines. It has one french bed (1,40x2m) and one single bed (90cmx2m), air condition, heating, private entrance, public parking in front. \nTraduci la descrizione dell'annuncio in italiano",https://www.immobiliare.it/annunci/114733143/,Appartamento,Affitto,,,,55,1,1,,Sì,,,Centralizzato,Autonomo,0,-1
2100.0,"Monolocale via Antonio Pisano, Borgo Venezia, Verona","Pregiato bilocale molto ben rifinito ed elegante con dettagli di gusto e materiali eccellenti. Composta da una camera da letto matrimoniale (possono diventare 2 letti singoli) soggiorno con divano letto a due postu, tv, wifi, bagno con doccia, zona cucina con lavatrice, piccolo giardino privato. Una chicca preziosa a pochi minuti dal centro storico\nTraduci la descrizione dell'annuncio in italiano",https://www.immobiliare.it/annunci/104458565/,Appartamento,Affitto,,,,55,1,1,,Sì,,,Autonomo,Autonomo,0,-1
