Prezzo,Nome,Descrizione,Link,Tipologia,Contratto,Piano,Piani edificio,Ascensore,Superficie,Locali,Camere da letto,Bagni,Arredato,Terrazzo,"Box, posti auto",Riscaldamento,Climatizzazione,Spese condominio,Cauzione
1900.0,"Trilocale via Prato Santo,3, Borgo Trento, Verona","[ITA] Disponibile da: 01/10/2024 Mensilità minime prenotabili: 1 Mensilità massime prenotabili: 6 Per prenotare l'annuncio clicca sul bottone ""Prenota Qui"" [ENG] Available from: 01/10/2024 Minimum months rental: 1 Maximum months rental: 6 To book the listing click on the button 'Book Here' [ITA] COMPOSIZIONE IMMOBILE Appartamento al primo piano, confortevole e luminoso. La cucina è completa di utensili da cucina. L'appartamento presenta la zona notte, composta da 2 camere da letto, 2 bagni, un’area salotto, una TV a schermo piatto, una cucina con frigorifero e forno e 2 bagni con bidet, Wi-Fi, lavatrice, asciugatrice, microonde, lavastoviglie, Nespresso, pass per parcheggio su strisce blu. A vostra disposizione asciugamani e biancheria da letto. ZONA Situato a Verona, a 600 metri dal Ponte di Castelvecchio e a 1,3 km dalla Basilica di San Zeno, il PratoSanto, relax nel cuore di Verona offre la connessione WiFi gratuita e l'aria condizionata. L'alloggio dista 1,4 km da Piazzale Castel San Pietro e 800 metri da Via Mazzini. In loco potrete usufruire del servizio di noleggio biciclette. I rinomati luoghi di interesse nelle vicinanze del Prato Santo, relax nel cuore di Verona includono il Ponte Pietra, Sant'Anastasia e il Museo di Castelvecchio. L'Aeroporto di Verona, lo scalo più vicino, dista 14 km dalla struttura. CONDIZIONI DI AFFITTO: In caso di contratto a società il canone sarà aumentato del 30%. SPESE CONDOMINIALI Il prezzo mensile non include le spese condominiali che ammontano a 100€/mese. UTENZE Il prezzo mensile include le utenze fino ad un massimale pari a 150€ che include luce, acqua e wifi. In caso di eccedenza, gli extra verranno dedotti dal deposito cauzionale. I dettagli verranno specificati sul contratto di affitto. [ENG] PROPERTY COMPOSITION Comfortable and bright apartment on the first floor. The kitchen is fully equipped with cooking utensils. The apartment features a sleeping area with 2 bedrooms, 2 bathrooms, a living area, a flat-screen TV, a kitchen with a refrigerator and oven, and 2 bathrooms with bidet, Wi-Fi, washing machine, dryer, microwave, dishwasher, Nespresso, and a parking pass for blue lines. Towels and bed linen are provided for your convenience. AREA Located in Verona, 600 meters from Castelvecchio Bridge and 1.3 km from Basilica di San Zeno, PratoSanto, relaxation in the heart of Verona offers free WiFi and air conditioning. The accommodation is 1.4 km from Piazzale Castel San Pietro and 800 meters from Via Mazzini. Bike rental service is available on site. The renowned attractions near Prato Santo, relaxation in the heart of Verona include Ponte Pietra, Sant'Anastasia, and Castelvecchio Museum. Verona Airport, the nearest airport, is 14 km from the property. RENTAL CONDITIONS: In the case of a company contract, the rent will be increased by 30%. CONDOMINIUM EXPENSES The monthly price does not include condominium expenses amounting to €100/month. UTILITIES The monthly price includes utilities up to a maximum of €150, which includes electricity, water, and wifi. In case of exceeding this limit, any extra costs will be deducted from the security deposit. Details will be specified in the rental contract.",https://www.immobiliare.it/annunci/113013877/,Appartamento | Intera proprietà | Immobile di lusso,"Affitto, transitorio",1,,,100,3,2,2,Sì,,,,,100.0,5700.0
1050.0,"Trilocale via Don Carlo Steeb 15, Valverde, Verona","Nel cuore di Verona, in zona Valverde, proponiamo al primo piano servito da ascensore, meraviglioso trilocale completamente ristrutturato. L'appartamento è composto da ingresso che conduce alla zona giorno con cucina a vista, camera da letto, balcone, bagno finestrato, ampia camera matrimoniale con bagno privato. Completa la proprietà una cantina la piano interrato. L'immobile gode di una doppia esposizione (zona notte interna e zona giorno esterna). Canone di locazione euro 1050,00 + 250,00 di spese condominiali mensili e comprendono riscaldamento, pulizia scale, ascensore, amministrazione ... Per tutte le informazioni potete contattarci al numero 0457900339 o tramite mail a imm.albertini@gmail.com",https://www.immobiliare.it/annunci/114635833/,Appartamento | Intera proprietà,"Affitto, 3+2","Interrato (-1), 1",5,Sì,85,3,2,2,No,No,,Centralizzato,Predisposizione impianto,250.0,-1
800.0,"Bilocale via Antonio Salieri 150, San Michele Extra, Verona","San Michele in Via A. Salieri trilocale arredato proponiamo appartamento ottimamente tenuto libero da subito . Piano terra.Ingresso, soggiorno angolo cottura, camera matrimoniale, bagno, terrazzo esclusivo. Molto luminoso. Termoautonomo. Utenze acqua, energia elettrica e gas autonome. Contratto transitorio annuale. Deposito cauzionale euro 2400. Nella nostra attività accompagniamo il cliente dalla ricerca o messa in vendita di immobile alla conclusione del contratto definitivo che sia di compravendita o di locazione. Ci occupiamo sia di compravendite residenziali e commerciali che di locazioni residenziali e commerciali annuali o stagionali. Con professionalità e serietà la nostra agenzia offre una molteplicità di servizi che ruotano a 360° su tutto il ramo immobiliare.",https://www.immobiliare.it/annunci/114237209/,Appartamento | Intera proprietà | Classe immobile signorile,"Affitto, transitorio",Piano terra,1,No,70,2,1,1,Sì,Sì,,"Autonomo, a radiatori, alimentato a gas","Autonomo, freddo",0,2400.0
1550.0,"Quadrilocale via Pellicciai, Centro Storico, Verona","Nel cuore della città, a pochi passi dalla splendida Piazza delle Erbe e nelle immediate vicinanze di tutti i servizi necessari, è disponibile in locazione un elegante e signorile appartamento ristrutturato e completo di arredo. L'immobile è collocato al piano primo di un palazzo storico di pregio ed è parte di un contesto residenziale molto tranquillo e lontano dal traffico, nonostante la posizione centrale. L'appartamento è composto da ingresso, soggiorno/pranzo, cucina, due camere da letto, soppalco con zona studio, due bagni con finestra e comodo posto auto nel garage condominiale. Disponibile da subito con contratto a lungo termine e in cedolare secca. Non disponibile per la sublocazione. Richieste referenze lavorative.",https://www.immobiliare.it/annunci/114468721/,Appartamento | Intera proprietà | Classe immobile signorile,"Affitto, 4+4",1,3,Sì,110,4,2,2,Sì,No,1 in parcheggio/garage comune,"Autonomo, a radiatori, alimentato a metano","Autonomo, freddo/caldo",0,4650.0
1400.0,"Bilocale piazza Erbe, Centro Storico, Verona","Nel centro pedonale di Verona, ubicato in piazza Erbe, una delle più belle piazze d’Italia, in elegante piccolo palazzo d’epoca completamente restaurato, prestigioso ed esclusivo appartamento arredato posto al secondo piano con ascensore, formato da: ingresso, soggiorno con cucina a vista, bagno con doccia, camera da letto matrimoniale con piccolo bagno dedicato. Termocentrale a gas metano con contatori di consumo individuale, aria condizionata. Utile vano cantina. Scorci e panorami unici. Euro 3.600,00/annui di spese condominiali comprensivi anche della quota riscaldamentoe/raffrescamento. Disponibile dal 1 OTTOBRE a single o coppia referenziati. NON UTILIZZABILE PER ATTIVITA' DI B&B O USO TURISTICO. A.P.E. classe G – I.P.E. 389,96 KWh/mq per anno. Contratto locazione di 3 anni + 2 anni con opzione ""cedolare secca"".",https://www.immobiliare.it/annunci/61539244/,Appartamento | Intera proprietà | Immobile di lusso,"Affitto, 3+2","Interrato (-1), 2",5,Sì,73,2,1,2,Sì,No,,"Centralizzato, ad aria, alimentato a metano","Centralizzato, freddo/caldo",300.0,-1
960.0,"Trilocale via Adigetto Adigetto, Cittadella - Porta Nuova, Verona","Ottimo il livello di finiture e di arredo, appartamento composto da ingresso, soggiorno pranzo angolo cottura, disimpegno, due letto, bagno. Spese condominiali comprese di riscaldamento. Si richiede contatto unicamente tramite e mail. Verrete contattati. Si richiedono referenze. No subaffitto, uso turistico e bed and breakfast. Possibilità contratti transitori.",https://www.immobiliare.it/annunci/92248452/,Appartamento | Intera proprietà | Classe immobile media,"Affitto, 3+2",1,3,Sì,95,3,1,1,Sì,,,"Centralizzato, alimentato a pompa di calore",Autonomo,117.0,-1
900.0,"Quadrilocale ottimo stato, Zona Fiera, Verona","b.go roma, quadrilocale arredato, disponibile da ottobre. ampio ingresso, soggiorno, cucina, due camere matrimoniali, bagno finestrato, due terrazze, cantina e garage. riscaldamento centralizzato con termovalvole. ottimo stato di manutenzione. condominio signorile con ascensore. contratto anni 3+2 con cedolare secca. richieste massime referenze. ideale per 2 medici/specializzandi o 2 professionisti referenziati che vogliono condividere l'appartamento. a pochi minuti dall'ospedale di borgo roma. classe energetica: f",https://www.immobiliare.it/annunci/114659921/,Appartamento | Intera proprietà | Classe immobile signorile,Affitto,"Interrato (-1), 3",5,Sì,91,4,2,1,Sì,Sì,1 in box privato/box in garage,Centralizzato,,200.0,-1
700.0,"Trilocale corso Porta Nuova 41, Cittadella - Porta Nuova, Verona","NON viene addebitata alcuna commissione di agenzia!!! Viene offerto in affitto uno spazioso appartamento ammobiliato con 2 camera da letto , soggiorno e cucina. Si trova in una zona tranquilla, vicino a negozi e supermercati e ai trasporti pubblici. Locali 3 Categoria catastale A2 Riscaldamento Climatizzazione predisposizione Piano 2 Posto auto incluso 1 Box, cucina, angolo cottura , porta blindata, allarme, fibra ottica , domotica , impianto tv privato .",https://www.immobiliare.it/annunci/108714105/,Appartamento | Intera proprietà | Classe immobile signorile,Affitto,2,5,,75,3,2,1,Sì,,,,,0,-1
930.0,"Bilocale via Duomo 19, Centro Storico, Verona","AFFITTASI solo a referenziati, appartamento in zona ZTL , all'interno di un contesto storico, arricchito dalla tranquillità di un affaccio interno di un delizioso giardino. Servito da ascensore, al piano terzo, l'appartamento è composto da ingresso nel soggiorno ampio e luminoso, cucina separata abitabile, 1 camere da letto matrimoniale ed un bagno. Erogazione acqua inclusa nelle spese condominiali. L'APPARTAMENTO E' ARREDATO E CORREDATO DI STOVIGLIE LIBERO DA Novembre 2024 Affitto transitorio di 12 mesi",https://www.immobiliare.it/annunci/114428723/,Appartamento | Intera proprietà | Classe immobile signorile,"Affitto, transitorio",3,4,Sì,94,2,1,1,Sì,,,,,85.0,-1
1200.0,"Attico ottimo stato, 109 m², Valdonega, Verona","In signorile palazzina, proponiamo in locazione ultimo piano con ascensore e garage privato. Immagina un appartamento dove il benessere e l'attenzione all'ambiente si fondono in un'unica soluzione abitativa. L’ appartamento in classe A1, è progettato e costruito con materiali e tecnologie all'avanguardia. All' ingresso l’ampio open space, illuminato da una grande vetrata, si apre su una terrazza abitabile con vista panoramica sulle Torricelle che rappresentano elementi imprescindibili per chi ama la convivialità. La zona notte, completa di due camere e un bagno finestrato, offre il massimo comfort. Ulteriore spazio dell'appartamento è dato dal quinto piano, a cui si accede attraverso una comoda scala interna, dove troviamo una spazio extra che può essere adibito a zona svago, ufficio o ulteriore camera da letto data la presenza di un ulteriore bagno con doccia. Completa la proprietà al piano interrato un generoso garage. Situata nella parte nord-orientale della città, Valdonega è rinomata per i suoi ampi spazi verdi, i parchi e le ville storiche che la caratterizzano. È un quartiere residenziale molto apprezzato per la sua tranquillità e per la vicinanza a tutti i servizi essenziali. In Valdonega trovi tutto ciò di cui hai bisogno: supermercati, negozi, scuole, ospedali e ottimi collegamenti con il resto della città. È un quartiere vivace e dinamico, ma allo stesso tempo residenziale e tranquillo.",https://www.immobiliare.it/annunci/114483857/,Attico | Intera proprietà | Classe immobile signorile,"Affitto, 4+4",Da 4 a 5,4,Sì,109,3,2,2,No,Sì,1 in box privato/box in garage,"Centralizzato, a pavimento, alimentato a gas","Autonomo, freddo/caldo",170.0,7200.0
750.0,"Bilocale via Scuderlando, 241, Borgo Roma, Verona","Caratteristiche del bilocale: - all-inclusive ad € 900,00/mese; - Contratto transitorio, no residenze e no locazione turistica; - Libero dal 1 ottobre al 31 marzo 2025; - Nessuna pertinenza. ATTENZIONE: NON CHIAMARE MA MANDARE MAIL CON REFERENZE! Nell'annuncio sono presenti tutte le indicazioni necessarie, se interessati si prega quindi di inviare quanto richiesto all'indirizzo richieste@casevr.it e sarete ricontattati quanto prima. Borgo Roma, proponiamo in locazione per il periodo dal 1 ottobre al 31 marzo 2025 ampio bilocale completamente arredato e composto da: ingresso, cucinotto, soggiorno, camera da letto matrimoniale, bagno e terrazzino. L'appartamento viene locato completo di elettrodomestici e corredo. Il canone complessivo di € 900,00 è comprensivo di tutte le utenze.",https://www.immobiliare.it/annunci/114520509/,Appartamento,Affitto,3,3,Sì,65,2,1,1,Sì,Sì,,Autonomo,Autonomo,150.0,-1
850.0,"Bilocale via Mastino della Scala 9, Borgo Roma, Verona","Si richiede un primo contatto alla mail vr1s4@tecnorete.it indicando nome e cognome, attività lavorativa svolta, recapito telefonico. Verrete ricontattati solo se in possesso dei requisiti richiesti dalla proprietà. Affittasi, ad una sola persona con contratto a tempo indeterminato, appartamento bilocale posto al secondo piano con ascensore di un contesto condominiale interamente ristrutturato nel 2021. Libero dal 1 agosto 2024. Ubicato a pochi minuti dal Polo ospedaliero di Borgo Roma e dall'università del quartiere. Posizionato in zona strategica, comoda ai principali servizi e in strada secondaria al traffico. L'ingresso affaccia direttamente sulla zona giorno, composta da cucina attrezzata e corredata con accesso al balcone. La zona notte presenta una camera da letto con balcone ed un servizio finestrato dotato di di doccia. L'immobile viene consegnato completo di arredo dal design moderno ed essenziale. Riscaldamento a pompa di calore, condizionamento autonomo. Possibilità di parcheggiare gratuitamente lungo tutta la via. Canone di affitto 850 comprenisvo di tutte le spese. Non è possibile portare la residenza.",https://www.immobiliare.it/annunci/113382701/,Appartamento | Intera proprietà,Affitto,2,3,Sì,40,2,1,1,Sì,No,,"Autonomo, ad aria","Autonomo, freddo/caldo",0,2550.0
1100.0,"Quadrilocale via Aquileia 23, Borgo Roma, Verona","Affittiamo a referenziati appartamento arredato ultimo piano SENZA ASCENSORE composta da: ingresso, cucina abitabile, soggiorno, due camere, due servizi, due balconi, cantina e garage.",https://www.immobiliare.it/annunci/114428147/,Appartamento | Intera proprietà | Classe immobile economica,Affitto,"Interrato (-1), 2",2,No,88,4,2,2,Sì,No,1 in box privato/box in garage,"Autonomo, a radiatori, alimentato a gas","Autonomo, freddo",60.0,3300.0
650.0,"Trilocale buono stato, piano rialzato, Borgo Roma, Verona","--- (PER INFORMAZIONI CONTATTARE ESCLUSIVAMENTE TRAMITE EMAIL ALL'INDIRIZZO: immobiliare@immobiliarelaveneta.it)--- BORGO ROMA: In contesto di sole 6 unità proponiamo trilobate al piano rialzato composto da ingresso, salottino con angolo cottura, camera matrimoniale, studio/cameretta, bagno, cantina e garage. L'immobile è disponibile da subito. Riscaldamento autonomo. TIPOLOGIA DI CONTRATTO: TRANSITORIO 12 MESI",https://www.immobiliare.it/annunci/114699621/,Appartamento | Intera proprietà | Classe immobile media,"Affitto, transitorio","Seminterrato, piano rialzato",2,No,74,3,2,1,Sì,Sì,1 in box privato/box in garage,"Autonomo, a radiatori, alimentato a metano",,40.0,1300.0
1200.1,"Bilocale ottimo stato, primo piano, Cittadella - Porta Nuova, Verona","Affittasi nel cuore di Verona, tra l'Arena e Piazza Cittadella, appartamento interamente ristrutturato e arredato, contesto di prestigio. Composizione: angolo cottura completo di tutti gli elettrodomestici inclusa lavastoviglie, zona giorno con travi a vista, 1 camera matrimoniale,  1 bagno finestrato con doccia. Termoautonomo. Aria condizionata. Piano 1° e ultimo. Contesto tranquillo e riservato in prestigiosa villa antica. Canone richiesto € 1.200, possibilita' affitto posto auto coperto con costo a parte. Spese condominiali ANNUE € 780,00 circa.   Libero da ottobre 2024, data esatta  da definire. Possibilita' di visionare  l'appartamento previo appuntamento con l'agenzia. Si chiedono referenze lavorative. NO SUBLOCAZIONE PER AFFITTI TURISTICI O BREVI.",https://www.immobiliare.it/annunci/31379354/,Appartamento | Intera proprietà | Classe immobile signorile,"Affitto, 4+4",1,1,No,55,2,1,1,Sì,No,1 in parcheggio/garage comune,"Autonomo, ad aria, alimentato a gas","Autonomo, freddo",65.0,3600.0
600.0,"Bilocale buono stato, primo piano, Veronetta, Verona","All'interno di un caratteristico palazzo storico, luminoso appartamento composto da ingresso, soggiorno con balcone, piccolo cucinotto con ripostiglio, camera da letto matrimoniale e bagno finestrato con box doccia e lavatrice. Termoautonomo e climatizzato. Le spese accessorie (spese condominiali, utenze di gas, luce e acqua, wi-fi internet e TARI) sono forfettariamente conteggiate in €250,00 mensili, da aggiungere al canone di locazione di €600,00 mensili. Contratto transitorio di 12 mesi. SOLO REFERENZIATI.",https://www.immobiliare.it/annunci/114235299/,Appartamento | Intera proprietà | Classe immobile media,"Affitto, transitorio",1,4,No,50,2,1,1,Sì,No,,"Autonomo, a radiatori, alimentato a metano","Autonomo, freddo/caldo",0,1200.0
850.0,"Bilocale piazza Cittadella, Cittadella - Porta Nuova, Verona","Ottima posizione e livello di arredamento, luminoso e spazioso bilocale completamente arredato, composto da ingresso, soggiorno pranzo, zona cottura, disimpegno, bagno, letto matrimoniale. Si richiede contatto esclusivamente via e mail. Verrete contattati. Si richiedono referenze. Contratto transitorio. No subaffitto, uso turistico e bed and breakfast.",https://www.immobiliare.it/annunci/113839865/,Appartamento | Intera proprietà | Classe immobile media,"Affitto, transitorio",2,4,Sì,85,2,,1,Sì,,,"Autonomo, a radiatori, alimentato a pompa di calore",,100.0,-1
2500.0,"Appartamento via Dietro Listone, Centro Storico, Verona","A due passi dall'Arena in pieno centro storico della nostra bellissima Verona, Affittasi a referenziati, appartamento luminoso posto al piano rialzato, ubicato in Residenza Storica. L'immobile, ottimamente mantenuto negli anni, si compone di ingresso ampio soggiorno, cucina separata abitabile, 2 camere da letto matrimoniale e 2 bagni finestrati. Per ulteriori proposte consultate il nostro sito : http://www.immobiliaremoletta.it",https://www.immobiliare.it/annunci/112042025/,Appartamento | Intera proprietà | Immobile di lusso,"Affitto, 3+2",1,3,,215,5,2,2,Parzialmente Arredato,,,Autonomo,Autonomo,0,-1
1050.0,"Appartamento Corticella Cadrega,3, Centro Storico, Verona","[ITA] Disponibile da: 22/09/2024 Mensilità minime prenotabili: 1 Mensilità massime prenotabili: 3 Per prenotare l'annuncio clicca sul bottone ""Prenota Qui"" [ENG] Available from: 22/09/2024 Minimum months rental: 1 Maximum months rental: 3 To book the listing click on the button 'Book Here' Si tratta di un appartamento monolocale arredato e corredato con tutto ciò che è necessario quando si è lontani da casa, il mio obbiettivo? farvi sentire a casa! qualsiasi sia il motivo della vostra permanenza, qui troverete una casa pronta all’uso e per brevi periodi! Il canone di affitto comprende tutte le spese, esempio utenze, spese condominiali, tassa rifiuti e wi-fi. Si tratta di un appartamento in centro storico a Verona, vicino a Piazza Erbe e Portoni Borsari, quartiere silenzioso e tranquillo, in particolare modo la posizione nel pieno centro storico vi permetterà di raggiungere ogni parte della città comodamente a piedi o con autobus. È anche molto vicino all'ospedale Borgo Trento, circa 1 km (15 minuti a piedi), è l'ideale per fare assistenza a qualche caro in modo sereno e tranquillo oppure se lavorate in ospedale e avete un lavoro a turni. e a 10 minuti a piedi dalla zona universitaria. IL MONOLOCALE è composto da: cucina + soggiorno con tavolo + letto matrimoniale (non divano letto), 1 bagno con doccia. la cucina è interamente attrezzata per permettervi di essere indipendenti nel vostro soggiorno.",https://www.immobiliare.it/annunci/109158715/,Appartamento | Intera proprietà,"Affitto, transitorio",3,,,40,,0,1,Sì,,,,,0,1050.0
800.0,"Trilocale via Giovanni Ongaro, Zona Fiera, Verona","BORGO ROMA - SANTA TERESA Agenzia affitta bell'abitazione arredata e suddivisa in ampio soggiorno con cucina lineare, camera singola e matrimoniale, bagno finestrato e terrazzo. Completa la proposta unaa spaziosa cantina ed un garage singolo. E' necessario inviare una vs. candidatura indicando nucleo familiare, occupazione e motivo / decorrenza della ricerca. No a contratti transitori o per condivisione. No a sublocazione turistica o per altra finalità. Necessario contratti di lavoro a tempo indeterminato. Termoautonomo. Non è presente l'aria condizionata. Zona servita. Esposizione tranquilla. Bel contesto condominiale. Parco pubblico adiacente. Prat.a08 AFFITTO CERTO gestione locazioni Gli specialisti della locazione a Verona. Marchio che opera a Verona da molti anni è sinonimo di trasparenza ed affidabilità. Offriamo servizi unici e di sicuro soddisfazione per il cliente. Proponiamo immobili in ottime condizioni di manutenzione e di arredi oltre che regolari dal punto di vista urbanistico e degli impianti. Siamo esperti in: - Locazione di appartamenti, immobili residenziali e commerciali - Gestione delle locazioni con espletamento di tutte le pratiche e gestione dei rapporti con l’inquilino - Manutenzioni - Gestione di interi patrimoni immobiliari - Consulenza immobiliare - Home Staging",https://www.immobiliare.it/annunci/113092353/,Appartamento | Intera proprietà | Classe immobile signorile,"Affitto, 3+2",2,3,Sì,90,3,2,1,Sì,Sì,1 in box privato/box in garage,"Autonomo, a radiatori, alimentato a metano",,40.0,-1
920.0,"Trilocale ottimo stato, piano terra, Borgo Trento, Verona","VERONA (BORGO TRENTO) (Se interessati scriveteci dall'annuncio di immobiliare.it e verrete ricontattati) In piccolo condominio storico, in Borgo Trento vicino all'Ospedale, si affitta trilocale arredato al piano terra, composto da: soggiorno open space con cucina a vista, camera da letto matrimoniale, seconda camera/studio, corridoio, bagno, due ripostigli, soffitta. Spazio esterno privato molto vivibile. Doppio ingresso anche da giardino, posto bici riservato. TIPOLOGIA INQUILINO: SINGLE/COPPIA REFERENZIATI TIPOLOGIA CONTRATTO: 3+2 CANONE CONCORDATO",https://www.immobiliare.it/annunci/113935349/,Appartamento | Intera proprietà | Classe immobile signorile,"Affitto, 3+2",Piano terra,3,No,90,3,2,1,Sì,,,"Centralizzato, a radiatori",,35.0,1840.0
790.0,"Monolocale ottimo stato, terzo piano, Centro Storico, Verona","CENTRO STORICO: (SI AFFITTA CON CONTRATTI DI TIPO TRANSITORIO) Nei pressi di Lungadige Matteotti, proponiamo in contesto signorile, appartamento mansardato all'ultimo piano con ascensore. L'appartamento è composto da cucina,  camera da letto matrimoniale, bagno finestrato con doccia. L'immobile è dotato di lavatrice e climatizzatore. DISPONIBILE DAL 5 OTTOBRE. Nelle spese accessorie di 210€ sono compresi tutti i costi relativi alle utenze e internet wi-fi.",https://www.immobiliare.it/annunci/107897949/,Appartamento | Intera proprietà | Classe immobile signorile,"Affitto, transitorio",3,3,Sì,45,1,1,1,Sì,No,,"Autonomo, a radiatori, alimentato a metano","Autonomo, freddo/caldo",210.0,2370.0
1600.0,"Bilocale via Scrimiari 10, Veronetta, Verona","In  Palazzo Storico,  contesto signorile, ultimo piano su due livelli, travi a vista, elegante appartamento, composto da ingresso, grande soggiorno,  con angolo cottura staccato, piccolo ripostiglio,  letto matrimoniale,  lavanderia,  bagno, completano l'unità una cantina e posto auto coperto. E' presente impianto di condizionamento. Si richiedono massime referenze.",https://www.immobiliare.it/annunci/110344411/,Appartamento | Intera proprietà | Classe immobile signorile,"Affitto, 3+2",2,2,,95,2,1,1,Parzialmente Arredato,,1 in parcheggio/garage comune,"Autonomo, a radiatori, alimentato a pompa di calore",Autonomo,0,-1
700.0,"Bilocale ottimo stato, primo piano, Avesa, Verona","AVESA: In piccolo contesto, proponiamo luminoso bilocale ristrutturato e finemente arredato composto da soggiorno con angolo cottura, camera da letto e bagno finestrato. Completano la proprietà una comoda cantina ed un garage singolo di piccole dimensioni. -TIPOLOGIA INQUILINO: SINGLE/COPPIA REFERENZIATA SE INTERESSATI RISPONDETE ALL'ANNUNCIO E VERRETE RICONTATTATI.",https://www.immobiliare.it/annunci/114085391/,Appartamento | Intera proprietà | Classe immobile signorile,"Affitto, 3+2",1,3,No,45,2,1,1,Sì,,1 in box privato/box in garage,Autonomo,"Autonomo, freddo/caldo",30.0,2100.0
